id,text,anger,disgust,fear,joy,sadness,surprise
tir_train_track_a_02647,"""ህዝቢ ኤርትራ ብፖለቲካዊ ቅልውላው ክሳቐ ክርእዮ ብልቢ የሕዝነኒ"" ጸሓፊ ዳን ኮኔል",0,0,0,0,1,0
tir_train_track_a_02648,ግዳም ሓደር ምስ ጓል 80 ዓመት ሃብታም መበለት - ሓቀኛ ዛንታ ፍቕሪ ወይስ ምትላል?,0,0,0,0,0,0
tir_train_track_a_02649,ግደውን ጽግዕተኛ ካብዝግስ ወዲ 70 ዓመት ኢካ ጃዕባብ ኣብታ ኤንባሲ ወረቃቅቲ ኣቀባብሎም ኢካ ንሙካኑ ጨው ዘይብልካ መጅላግ ኣረጊት ልዕሌካ ደንቆሮን ሓሳውን ከ ኣሎ ድዩ ከዳዕ 50,0,1,0,0,0,0
tir_train_track_a_02650,ቱ ሐዚ ለሎ ናፀጥታ ሓይሊ ጉዱኣት ኲናት ብፆቱ ተሰሊፍኹም ኢሉ ለንገላትዐ እዩ። ከመይ ጌሩ ንመንእሰያት ክምሕር? ከይተረድኦ ወይለ ተረዲእዎ ናይ ሕወሓት ሪፐብሊካን ጋርድ ኾይኑ ኣሎ።,0,0,0,0,1,0
tir_train_track_a_02651,ደቂ ዓደይ መዓረይ  እመብርሀን ትሐልኹም እግረ መንገድኹም ቻናለይ ሰብስክራይብ  ዘይገበርኩም ሰብስክራይብ ግበሩለይ ናይ መጀመርያ ቻናለይ ተደምሲሱኒ እዩ,0,0,0,0,0,0
tir_train_track_a_02652,እንካዕ ን 2015 ዓም ( ዓመተ ግእዝ) ኣቆፃፅራ ግእዝ ኣብፃሓኩም ኣብፃሓና። ዓመተ ራህዋ ወ ሰላም ቅሳነት ይግበረልና ። እዚ ጥዕምቲ ዜማ ናይ ቱኩእ ሑደጎ ሆያ ሆየ እትብ,0,0,0,1,0,0
tir_train_track_a_02653,ቅልውላው ትግራይ፡ ኣሜሪካ ኣብ ልዕሊ ኤርትራውያን ስደተኛታት ዝፍጸም ዘሎ መጥቃዕቲ ከምዘሻቐላ ገሊጻ,0,0,0,0,0,0
tir_train_track_a_02654,ሰራዊት ኣመሪካ ኣብ ልዕሊ ብኢራን ዝድገፉ ዕጡቓት መጥቃዕቲ ኣካይዱ,0,0,0,0,0,0
tir_train_track_a_02655,ነብስኻ የዕቢኻ፡ ካልእ ህዝቢ ምንእኣስ እዩ! እቲ ዝገርም ከማን፡ ዉሑድ ዘለዎም ብሄራት እዮም ነቲ ዝበዝሐ ህዝቢ ዘናሽዉዎ ዘለዉ!,0,0,0,0,0,1
tir_train_track_a_02656,ኣቱም ሰባት ውዕሊ ፕሪቶርያ እንታይ ከም ዝብል ብዝርዝር ዝፈልጥ እንዶ ክንደይ% እዩ? በቃ ሰላምና ይተዓቀብ ክንብል ኣለና ዘይንፈልጥ እታ ሓቂ።,1,0,0,0,0,0
tir_train_track_a_02657,ክውገዝ ዘለዎ መሕፈሪ፣ ነውራምን ጭካነ ዝተመልኦ ተግባር ህወሓት ወለድናፍትሑዎም,1,1,0,0,0,0
tir_train_track_a_02658,ታይ ዩ ጉዱ ተቀባልነት ንምርካብ መከራኻ በሊዕኻ...every minutes post😄,0,0,0,0,1,0
tir_train_track_a_02659,ኲናት ሶርያ፡ ብዓሰርተታት ሽሕ ዝቑጸሩ እሱራት ደሃዮም ከምዝጠፍአ ሕቡራት ሃገራት ገሊጹ,0,0,0,0,0,0
tir_train_track_a_02660,ሃገርና ኤርትራ ካብ ዝርኣየቶም ሓደ ካብ ብሉጻት ተቀዳደምቲ እዩ። ንክለብ ኣስቤኮ ከም ሓለቃ ጋንታ ብሙኻን ኣዝዩ ብዙሕ ዓወታት ዘግዘማ ዝመርሓን፣ኣብ ዝተፈላለየ ኣጋጣሚ ንሃገራዊት,0,0,0,1,0,0
tir_train_track_a_02661,ወቕቱ ዝፈጠሮም ጀጋኑና ዝግበኦም ክብሪ ንምሃብ ! ኣብ ብረታዊ ቃልሲ ህዝቢ ትግራይ ን17 ዓመታት ኣብ ዝነበረ መሪር ተጋድሎ ዝተቃለሱ ጀጋኑና ክዋሃቦም ዝግባእ,0,0,0,0,0,0
tir_train_track_a_02662,ቅድሚ 3 መዓልቲ ሰሚዐዮ ነይረ  ብሰበሰብ  ግን አይአመንኩን ነይረ  ዝገርም ዩ,0,0,0,0,0,1
tir_train_track_a_02663,ወለድ  ኤርትራ ሲ ኤህ ደኣ ን ነብስኹም ሓቢእኩም ደቅኹም ን ሞት ትሰዱ ዘይ ወለዲ,0,0,0,0,1,0
tir_train_track_a_02664,ዓድዋ ሰብ ዋና ኣለዉዋ። ዓወት ዓድዋ ምልክት ፅንዓትን ተምሳሌት ሓርነትን እያ። ዓድዋ ኣብ ሓዘን እውን ዘተሓዝና፣ ዝድብሳ እያ ትደሊ። ኣብ ዓወታ ዝዝክራ ኣይትደልን።?,1,0,0,0,0,0
tir_train_track_a_02665,ኣነስ ቀደም ኣውኬልኩም ኔርየ ሓንሳብ ሰራዊት ኣቢይ ተጀሚሩ ኣይሓድገኩምን ኣብ ራዕድን ጭንቀትን ከእትወኩምዩ ሰላምን ፍቕርን ይሕሸኩም ብሕጊ ሞግትዎ ወይ ዓንቀጽ 39 ኣልዒልኩም መጉትዎ ኩናት ተተወሊዓ ኩላትኩም መሪሕነት ክልላዊ ትግራይ ብሂወት ክትጸንሑ ዕድልኩም ምህሙንዩ ኢለ ኔረ ግደፉ ግደፉ ተባሂልኩም  ሕጂ ዘለኹሞ ፍርሕን ራዕድን ዘይፈልጥ የዋህ ጥራሕዩ ንሕና እኳ እንታይ ክኾኑዮም ንብል ኣለና ግን ዘሕዝን ህዝቢ ትግራይ ምልካምኩም,0,0,0,0,1,0
tir_train_track_a_02666,ይብል ዶ የለኹን፤ ኣነሲይይ ንትግራይ ዓድና ኣፀቢቐ ኣይፈልጣን ነይረ። እሞ ቲ ዝገርም ንኹለን ወረዳታት ትግራይ ዘይረ ናይ ምርኣይ ዕድል ግን ነይሩኒ። ካብ,0,0,0,0,0,1
tir_train_track_a_02667,ናይ ሃዝቢ ሓላፍነት ዝስከም ከማኹም እዩፖለቲከኛ ን ስነጥበባውያን ሓራ ኩኑ ዝብል ለባምንናይ ራእን ሰብ ማለት ከምዚ እዩውናት ተብዓት,0,0,0,1,0,0
tir_train_track_a_02668,ኣሉላ ንእግረ መገድኹም እስኪ መፍቲሑ ሰውኣብሉ እሞ ካልእት ካባኹም ሪኦም እንተተተቀባብልዎ። ከም ዘፀኣትጥራይ ነቄፈታ ፅቡቅ ኣይመስለንንን። ዘፀኣት ብጣዕሚ ዘይነፅፍ መፍትሒ ዝፅሕፍ talent ዓቅሚ ኣለዎ ግን ክፅሕፍ ኣይረኣኹን።,1,0,0,0,0,0
tir_train_track_a_02669,ኣብ ስነጥበባውያን ምጽላም ሓሶት ምዝርጋሕን ተዋፊራ ኣላ,0,0,0,0,0,0
tir_train_track_a_02670,ጽቡቕ ሕቶ እዩ ?,0,0,0,1,0,0
tir_train_track_a_02671,ክብርን ሞጎስን ንጀጋኑ አሕዋትና ብአኩም ኩሩዓት ኢና አትሕቲ መድሓኒአለም,0,0,0,1,0,0
tir_train_track_a_02672,ግዜ በጃካ እባ ግልፅ በለና ህፃውቲ ኣብ ክንዲ ትምህርቲ ጭንቀትን መከራን ብዝሕዎምኣብ ክንዲ ማሙቅ ገዘኦም ክርተት ኣብ ጎደናታት ኣብክንዲ ጊባቦናይ እድኦም ቆርሶም ዝበልእሉ ኣብ,0,0,0,0,1,0
tir_train_track_a_02673,መዓርግ ዘቕረብካዮም ሓሳባት ፅቡቓት እዮም።ትግራዋይነት ከምዚ እዩ።,0,0,0,1,0,0
tir_train_track_a_02674,ውልቀ መላኺ ኣይትበሉ ዋ ስራዊት ኣራዊት ኤርትራ በሉ ሚዲያታት ትግራይ ኣደብ ግበሩ,1,0,0,0,0,0
tir_train_track_a_02675,ማንም ይኹን ማንም ንህዝቢ ዘየቀድም ብዛ ዝሰረሓ ክፍተት ይንቀፍ።እቶም ካብ ባዕልኻ ጀሚሩ ሽሕ ግዜ ትሰሓሀቱ አለኹም ህዝቢ ጎዲእኹም ዝበሃሉ ዘለው ዝሰረሕዎ ፅቡቕ ሰራሕ ስለዘየለ አይኾነይ።መሰመርኹም ስሒትኹም እዩ እቲ ነጥቢ,1,0,0,0,0,0
tir_train_track_a_02676,munamoh8479 ኣነ ናብዚ ኪድ ኣይበልኩንዕላማ ናይዚ ኲናት ንገረኒ እየ ኢለካ እምበር እቶም ኣዛብእ ናይ ዓድና ካብ 1998 ክሳብ 200 ዝበለዖም ተጋሩ ኤርትራ ሃገሮም ኮይና ድያ ድራር ኣራዊት ኮይኖም ሳሕሳሕ ትግራዋይ,1,1,0,0,0,0
tir_train_track_a_02677,እዚኦም ምስ ሽፍታ ዓዲ ሃሎ ኮይኖም ዓባይ ኢትዮጵያ ዝሓልሙ እንድዮም። ዓገብ ዝብሎም የብሎምን,0,1,0,0,0,0
tir_train_track_a_02678,(24) ?ስውእ ተጋዳላይ ተኸስተ ገብረመድህን? ገዲም ተጋዳላይ ስውእ ተኸስተ ገብረመድህን (ኤለ) ብሉጽ ተጻውታይ ጋንታ እምባሶይራ ፡ ሕርይቲ ጋንታ ኤርትራ ፡ ሃገራዊት ጋንታ,0,0,0,0,0,0
tir_train_track_a_02679,እዋይ ኣንታ ደንቆሮ ሰብኣይ ተማሂረ እየ ኢልካ ዲኻ ኣብታሪኽ ዘየለ እንዳምጻእካ ትትንትን ዘለኻ።?ምከሮው ምከረው፣ ኣልሰማም ካለ መከራው ይምከረው።,1,1,0,0,0,0
tir_train_track_a_02680,ጽቡቅ! ኣብ ገዛእ ሃገሮም ቦታ ስለ ዝኸላእካዮም እየ። ኣብ ፍትሒ ዝኣምን፡ ጽልኢ ኣብ ሕይወቱ ቦታ የብላን፡ ብመትከል፡ ብፍቅሪ፡ ስለኩሉ(ስለቶም ብዘይፍላጥ ነቲ ገፋዒ ዝ,0,0,0,0,0,0
tir_train_track_a_02681,ክጓዓዝየ ተስፋንድዩ ስንቂ ጉዕዞ ጸዋራት ንባዓል ዕላማ ዓይኒለው ኣብ ጸልማት ! Dawit Solomon !,0,0,0,0,0,0
tir_train_track_a_02682,ዋይ የሕዋተይ መጻወቲ እዞም ሓሳዳት ሓሶት ድራሮም ዶ ኮይንኩም ደሓን መድሃኔ ኣለም ይሓልኹም ። ከላሽን ኣብ ግንባሮም ገይርኩም በሉ እና በልኩም ከም ዝገበሩ ጌር,0,0,0,0,1,0
tir_train_track_a_02683,ሓሰም ዘሕሰውኹም ንመምህር ሓሶት ተጋሩ ገርገራ ኮ ዓዲ ብድጋ ዝተኸበ ጹዑቅ ህዝቢ ዝቅመጠሉ ኢዩ ኣበይ ኢዮም ኪዕሎሙ መምዘኒኹም ዝኸነወረ ኣይትዘርግሑ ጭብጢ ሓዙ መውዓሊ ዝኸነ ሓሶት ግደፍዎደቂ ማይ ጠላሚት game over,0,1,0,0,0,0
tir_train_track_a_02684,ሓሶት ሓጥያት እዩ ንኽሕስዉ ስክፍ ዘይብሎም እኳድኣ ከም ፖሎቲካዊ መክሰብ ዚወስድዎ ኣብ ኩሉ ቅጸላታት ሕብረተሰብ ትግራይ ዝአተወ ባህልዩ።ዘገርም ግን ብሓሶት ዚቀንዖን ዚተዓወተ የለን,0,1,0,0,0,1
tir_train_track_a_02685,ትግራዋይ ሓሚሙ ኣይሞትን ግቡኡ ፈፂሙ እምበር,1,0,0,0,0,0
tir_train_track_a_02686,እስራኤል፡ ዘገርም ምልሰት በንጃሚን ናታንያሁ ናብ ስልጣን,0,0,0,0,0,1
tir_train_track_a_02687,ዋውው ዋሪ ሓወይ ደስ ይብል ናይ ልብና ናገር ስራሕ እዩ እግዚአብሔር ኣምላክ ይኮኖ ይባለና ስቃይ ህዝብና,0,0,0,1,0,1
tir_train_track_a_02688,ንህዝቢ ትግራይ ጅሆ መትሓዚ ካልእ ሜላ ናይ ህወሓት እዩ እዚ ህወሓት ናይ ስልጣን ኢጎን እምበር ትግራይ ንምግንጻል ሓሲባ ኣይትፈልጥን እያትግራይ ሃገር ክትከውን ከምዘይትኽእል እውን ትፈልጥ እያ ብስማን ብተፍርዮ ናይ ፕሮፖጋንዳ ሓሶትን ግን ንህዝቢ ትግራይ ኩሉ ግዜ ተታልሎ,0,1,0,0,0,0
tir_train_track_a_02689,Báshá Déstáከምዚ ት ኣብ እስርቤት ዝዓበዳ ግን ድማ ሕጂ ዝፈለጥናዬ ጫሓም ዕውድ ቢንያም ውሕስነት ምግቢ ብኣድጊ ከልቢ ይረጋገፅ ኢሉ ዘዕለለለ ማለት ድዩ ዝኸውን ዘሎ? ብዝኾነ ድሕሪ ዝሽምግልና ህወሓትን ባሻይ ናብ መዝየምኩም በቃ!!!,0,1,0,0,0,0
tir_train_track_a_02690,ሓደ ዓዋንሲ ጌታቸዉ ረዳ ኣብ ትግራይ ዓወት ይሕፈስ ኣሎ ኢሉ ክብል ምስ ሰማዕኩ ገሪሙን። ዓወት እንተድኣ ይሕፈስ ሃሊዩ፡ እንታይ ድኣ ኣምጽኦ እዚ ኩሉ ኣውያትን ብኽያትንTPLF። ክሳ,0,0,0,0,0,1
tir_train_track_a_02691,ሰላም የሕዋት ኣብ ዘለኹሞ ሰላምን ጥዕናን እንዳተመነና ብሉጻት መግብታት ንጥዕና የዒንትና ዝሓዘት ቪድዮ ሒዝናልኩም መጺእና ኣሎና ኣብዛ ሊንክ ብምጥዋቕ ክትክታተሉ ድማ ብክብሪ ንዕድመኩም ##URL##,0,0,0,0,0,0
tir_train_track_a_02692,ግምት ኣብዛሓ ትግራዋይ ነይሩ ግን ኣይቀነዐን ዝመስል,0,0,0,0,1,0
tir_train_track_a_02693,ዋዕሮ ተጋዳሊት ገነት ሓድሽ እንቋዕ ብሂወት ተረፍክልና ጸላእትኺ ብሞት ደፊርክዮም ኢኺ ኲርዒ ተሓበኒ,0,0,0,1,0,0
tir_train_track_a_02694,ገና እቲ መደበኛ ሰዓት ኣይተወደአን ተወሳኺ እውን ክንፅበ ግድን እዩ never give up,0,0,0,0,0,0
tir_train_track_a_02695,Tplf isis trorist group ዘይስምዖ ባ የብለይን እንትያ ዳኣ ኮይኑ ቨድካቸው ህውሓት ሽፍታ ምካኑ ስራዊቱ ስረቅቲ ምክኖም ዝምስክር ዘሎ Eritrea Ethiopia,0,1,0,0,0,0
tir_train_track_a_02696,ካብዚ ንላዓሊ ከይመጻካ ግደፍ ኣንታ ጁንታ።,0,1,0,0,0,0
tir_train_track_a_02697,ኣብ መንጎ ኤርትራን ኢትዮጵያን ተፈጥሩ ዘሎ ሰላም ዝንቅንቆ የለን። EritreaPrevails,0,0,0,0,0,0
tir_train_track_a_02698,ትምኒተይ እንካዕ ብሰላም መፃኺ ሰላምን ራህዋን ቅሳነትን ፍትሕን ንውፅዕ ህዝበና የውርደልና ኣምላክ ዓወትን ፅንዓትን ሓቦን ቅልፅምን ንሰራዊትና ይሃበና ምዕባለን ልምዓትን ለምለምን ዕንበባን ንትግራይና ይሃበና,0,0,0,1,0,0
tir_train_track_a_02699,ጳጳስ ፍራንሲስ፡ ንኣተሓሕዛ ስደተኛታት ኣብ ሃገራት ኤውሮጳ ኮኒኖም,0,0,0,0,0,0
tir_train_track_a_02700,ኣነ ዝብል አብይ ምስሕዝቢ ምንም ሽግር የብለይን ይብል አሎ እንታይ ማለት እዩ  ነቲ  ሕዝቢ ዘይትሓዝንሉ ክተት ትብልዎስ ንምንታይ እንታይ  እዩ እቲ ምኽንያትኩም  እቲ ሕዝቢ ሰላም እዩ ዝደሊ,0,0,0,0,0,0
tir_train_track_a_02701,አየኹም አቦታትና ግን ሓደ ነገር አለኒ ክገልፆ ዝደሊ አብ ስዑዲ ዓረብ ቤት ማእሰርት ዘለው ተጋሩ ፈልዩም የሳቅዮዎም እና ክርስትያን ድኹም ላበሉ ይፈልዮም አለው እዚ ድማ ናይቲ ርጉም አብይ ስራሕ እዩ እዛ መልኽቲ ዳብ ዝምልከቶ አካል ትበፅሕ አሎዋ  ፈጥንኹም ክትበፅሑሎም አለኩም ብርግጥ አብጭንቀት ከምዘለኹም አይጠፍአንይ ግን እናሞቱ ዝለዝኾኑ እዩ ትግራይ ትዕወት ናይ አብርሃም አምላኽ ምሳኹም ይኹን ጀጋኑ አቦታትና,0,0,0,0,1,0
tir_train_track_a_02702,ናብ TDF  ፒፒ ሓደገኛ ሰለልቲ ኣብ ሕድሕድ ከተማታት ኣቕሚጡ ኣሎ ኔትዎርክ ተዘይዓፅዩ TDF ብሓባር ተኣኻኺብካ ብመኪና ዝገብሮ ምንቅስቓሳትን ሎጂስቲክ ዘቕምጠሎም ከባቢታትን ካብ ታርጌታት ፀላኢ ዝረሓቑ ክኾኑ ኣለዎም,0,0,1,0,0,0
tir_train_track_a_02703,እሞ ድክነት እኮ እታ ጣይታውን ፀብሒ እውን ንከይትረክብ እዩ ዝገብረካ ። ሰብ ንክህፍትም ነበረታትዕ ድካዊ መዕዳ እዩ እምበር ዘረባ ለባማት አይኮነን ። ተጋሩ ክትህፍትሙ ፅዓሩ ደሓር እቲ ጣይታ ብወርቂ ሸሓነ ክትበልዕዎ ኢኩም ። እቶም ምሰላታትና እማ ዝደከየ ፃዲቅ ዝሀፍተመ ሓጢያተኛ ዝዓይነቱ እዮም። ክእለዩ አለዎም። አነ ህፍትም ውዒለ ህፍትም ክሓድር እየ ዝደሊ ።,1,0,0,0,0,0
tir_train_track_a_02704,ዓንደ ጸልማት የቐንየልና፡ ተገጢምካ ኢኻ።,0,1,0,0,0,0
tir_train_track_a_02705,ኣታሞ ታይ እዩ ሰብ ምግቢ በሊዑ እዩ ዝነብር ኣንታ ቫይረስ ሽንትቤት ርእሲ ታይሞ ይርደአኩም ንስኩም ኣራዊት።ሰብ ብካሊእ ይኮርዕ እስካ ድማ ብሰብ ጥምየት,0,1,0,0,0,0
tir_train_track_a_02706,ቃልስና ሓፂርን መሪርን እዩ ዓወትና ናይ ግድን እዩ ።,0,0,0,0,0,0
tir_train_track_a_02707,እቲ ፃዕራም ህዝብና ናብዚ ብርኪ እዚ ወሪዱ ምርኣይ ካብ ልቢ የሕዝን ! ካብ ቃላት ንላዕሊ ዝንበብ ምሰሊ ህዝብና!? TigrayGenocide EritreaOutOfTigray,0,0,0,0,1,0
tir_train_track_a_02708,ሓኹም ናይ ትግራይ ዎያኔ ናይ ኤርትራ ሰራዊት ክሕግዝኹም ትደልዩ ዘሎኩም ብዎያኔ ኽንደይ ግፍኣዒ በጽሕዎ ህዝቢ ኤርትራ ደም ኤርትራዊ መላገጺ ተጋሩ እዩኩሉ ህዝቢ ኢትዮጵያ ናይ ደርጊ ሰራዊት  ኣካክብኩም ኽንደይ ዎራር ገርኩም ከተብቅዑ ሕጂ ሓግዙና ክትብሉ ብጣዕሚ ዝገርም እዩ,0,0,0,0,0,1
tir_train_track_a_02709,ጸላኢና ንጹር ህግደፍ እዩ,0,1,0,0,0,0
tir_train_track_a_02710,ኣጆኻ ሄኖክ ሓዉና በይንኻ ኣይኮንካን ኩሉ ህዝቢ ኣብ ጎድንኻ እዩ ከምዚ ዓይነት ክሲ ህግደፍ ከማን ኣይገበርዎን እቲ ዝገርም ጎን በዘይ ካሕሳ ተሰጊጉ ክንሱ ካብኡ ክከሓሱ ምድላዮም እዩ .,0,0,0,0,0,1
tir_train_track_a_02711,Oasis Redsea ኣይይ ወዲ ጥልያን ወድዞም ዑሱባት ባንዳ መሕፈሪ እሞ ሕጂ ንስኻስ ሰብ ተቖፂርካ ተዛሪብካ ሞይትካ ማለት ድዩ ሂሂ,0,1,0,0,0,0
tir_train_track_a_02712,#Basha ኣታ ሓሳዊ ሓቃዊ ዝኮነ ዘረባ እዩ ተዛሪቡ,1,1,0,0,0,0
tir_train_track_a_02713,ካሐዲ ክልተ መልሐሱ ከም ተበን ነዚኦም አሚኖም ብሽም ሰላም እግረሙን ኢደሙን አሲሮም ሰክ ኢሎም ዘለዉ መራሕትና እና TDF ን ገሪሙና አሎ መግዚ,1,0,0,0,0,0
tir_train_track_a_02714,ኣትዮ እሱ ግዲ ጥዑም? ለለ ብኮፒright ክኸሰካ እየጨመረ,0,0,0,0,0,0
tir_train_track_a_02715,አሻሐት ደቃ ዘሰወአት ትግራይ አይትኸውንን በከንቱ አሻሓት ዝሰወአት ኤርትራ በከንቱ ከቶ አይክትከውን አወት ንሓፍሽ ውድቀት ን አድሓርያን,0,1,0,0,0,0
tir_train_track_a_02716,እዚ ዂናት ብሓቂ ህዝባዊ እንተኾይኑ ንምንታይ ደቂ ዓድዋ ብፍሉይ ንህዝብና ክዕፉኑዎን ሓሳቡ ከይገልፅን ናይ ቓልሲ ንፅረት ከይህልዎን ይረባረቡ ? ንምንታይ ዲፕሎማስን ፖለቲካን ቓልሲ,0,1,0,0,0,0
tir_train_track_a_02717,ዘገርም እዩ እነውን ሰሚዐዪ እሞ ብጣዕሚ ተገሪመ። ተጋሩ ገለ ሓሰኻ ወይ ነቀዝ ኣትዩዎ እዩ እቲ ሓንጎሊም፡ እዚ ሰብኣይ ብዛዕባ ሓደ ሚልዮን ዝኾኑ ተጋሩ መንእሰ,0,0,0,0,0,1
tir_train_track_a_02718,ስዊድን ኣብታ ሃገር ዝተላዕለ ህውከት ንፖሊስ ዒላማ ዝገብሩ ጉጅለ ገበነኛታት ምትሕሓዝ ዘለዎምዮም ትብል,0,0,0,0,0,0
tir_train_track_a_02719,በብዘለኻዬ ምኽታትን፣ምምካት እዩ። ጋንታ ሓሶት ድራሮም ናይ ሞራል ካምፓስ ስለዘይብሎም ሓደገኛ እዮም። ደቂ ዛ ሓላል መሬት አይንዘንግዕ ?,1,0,1,0,0,0
tir_train_track_a_02720,ኣይትገደድሉ ክንደይ ግዜ ይሪኦ እየ ! ምስቲ ስእዓት connection ከም ዘለዎም እዩ ዝርድኣካ ! ግርም ይብለካ !,0,0,0,0,0,1
tir_train_track_a_02721,ኣረዝገርም ነገርዕጥቂ ምፍታሕ ይብሉ እቲ ናኢትዮዽያ ሰራዊት ዘለዎ ቦታታት ብፋኖ እናተወረረ እናታኣሰረ ዕጥቂ ጠቅሊሉ ተውሪዱ እማ ሰብ ኣይገድፋልናን ንምሕሳቡ የሽግረልካ ዕጥቂ ምፍታሕ ብስሩ ክሕሰብ የብሉን,1,0,0,0,0,1
tir_train_track_a_02722,ሃይለሚካኤል ተባዕ ትግራዋይ ከም ኣቦታቱ ኣይኮነን ዶ በበይንና ሓቢርና ውን ሓያል ብደሆዩ ዝጽበየና ዘሎ ካብ ገጽ መሬት ሓኺኾም ከጥፍኡና ለይትን ቀትርን ዝሰርሑ ኣምሓራን ኣስላምን ዝብሃሉ ጸላእቲ ኣለዉ ስለዚ ብሓደ ምስራሕ ናይ ሞትንህየትን ጉዳይዩ,0,1,0,0,0,0
tir_train_track_a_02723,እታ ሳላ ጎይታኻ ኢሳያስ መስተይ ማይ ኣግማል ኮይና ዝተረፈት ወደብ ዓሰብ ድያ ሓቀይ? ጎይታኻ ሰሚዕካዮ ትኸውን ኢለ ይግምት፣ ባጽዕ የለ፣ ዓሰብ የለ ክብል ከሎ።,1,1,0,0,0,0
tir_train_track_a_02724,ድሮግባ ንፕረዝደንትነት ፈደረሽን ኩዕሶ እግሪ ሃገሩ ተወዳዲሩ ተሳዒሩ,0,0,0,0,0,0
tir_train_track_a_02725,ዓጋመ ኣይትሕረቃ ተረጋግኣ!? ትስዕራ መሲልክን ኲናት ጀሚርክን፡ ፈኪርክን፡ ተጃሂርክን፡ መወዳእትኡ ድማ ኣብ ታሪኽ ይቀመጥ እንዳ በልክን ትበኽያ ኣለኽን። እን,0,1,0,0,0,0
tir_train_track_a_02726,ደንቆሮ ሙሁር ኣብ ሕርሲ ዝቀረበት ሰበይቲ ዘይትዛረቦ የልብላን,0,1,0,0,0,0
tir_train_track_a_02727,እዚ ዝገርም ኣይኮነን ኣብ ሕንፍሽፍሽ ዘላ ዓዲ ግድን እዩ ከምዚ ዓይነት ውፅኢት ። ተጋሩተምሃሮ ዘይብሉ ከ ከመይ ክሳካዕ,0,0,0,0,0,1
tir_train_track_a_02728,አነ ዝብል እዞም ሙሩኻት ተተሰዲዶም አብ ሰላምና ዕቅፍት ከም ዝኾኑ ንእመን,0,0,1,0,0,0
tir_train_track_a_02729,ሰላምና መልሰልና ፈጣሪ ኣቦይ,0,0,0,0,0,0
tir_train_track_a_02730,ዓባይ ትግራይ ክትብሉ እታ ንእሽቶይ ክልልኩም ብጥሜትን ኲናትን ኮስቲርኩማ። ዓባይ ትግራይ ዝብሉ ናይ ሎሚ ወለ,0,1,0,0,0,0
tir_train_track_a_02731,‘በላዒ ሰብ ኢኻ ይብሉኒ’ - ብሕብረተሰብ ዝተነጽገ መንእሰይ,0,0,0,0,1,0
tir_train_track_a_02732,ክሕደት ጥልመት ስርቂ ምርካስ ሃይማኖት ካብ ዶናቁር ወረርቲ ሩኩሳት ኣመንቲ ሓይልታት ፉጡራት ህዝብታት እምነት ፆሎት ክብሪ ፅንዓት ጥም,0,1,0,0,0,0
tir_train_track_a_02733,ዝገርም እዩ መን እዩ ትግራዋይ ተዋጋኢ ኣይኮነን ዝበለ እቲ ሕቶ እንታይ ጨበጥና እዚ ኹሉ መንእሰይ ከየጥፋእናስ እዚንሄናሉ መን ከሊእና ነሩ ሕጂኸ እንታይ ክንጭ,1,0,0,0,0,1
tir_train_track_a_02734,ኣብ ቤት እግዚአብሔር ሰላም ኣሎ፤ ፍቅሪ ኣሎ፤ ሓድነት ኣሎ፤ ደስታ ኣሎ፤ ዕረፍቲ ኣሎ፤ነፃነት ኣሎ፤ ድሕነት ኣሎ።? ናብ ቤት እግዚኣብሄር ንኺድ፣ ምስ በሉኒ ተሓጐስኩ። መ,0,0,0,1,0,0
tir_train_track_a_02735,አሕዋተይ ብጥምየት ተጎዲኦም ቁራስ እንጀራ ዝሕቦም የለን ዐዲ ማቶም ትግራይ ነፃ ዘይወፀት አ አበባ ዝገርም እዩ ሕዝቢናብ ጭንቀት አትዩ,0,0,0,0,0,1
tir_train_track_a_02736,ዓንደጸልማት ሕጂ እውን መርገጹ ይነግረና ኣሎ።እዚ ክኣ ን ኣብ ጎድኒ ዓንደጸልማት ኮይንና ንቃለስ ኣሎና ዝብሉ ብዝያዳ የገድስ።,0,0,0,0,0,0
tir_train_track_a_02737,ህዝብና ኣስተውዒሉ፡ዝሓለፈ ይኣክል፡እዚ ኹናት ናይ እሰያስ ኩናትዩ ብምባል ዕጭ ሓንፊፉ።ብዛዕባ መን ክመውት መን ክብለጽ ዝበልካዮ ግን,1,0,0,0,0,0
tir_train_track_a_02738,ጅግና ተጋ ሚንስተር የማነ ገመስቀል ኣብ ግዜ ንእስነቱ ኢዩ ብዝገርም ፓሎቲካዊ ንቅሓትን ትንተናን ትግረም እሞ እዚኦም ዝምህርዎን ዘፍርይዎም መንእሰይ ምስ,0,0,0,1,0,0
tir_train_track_a_02739,ስምምዕ ሰላም ኢትዮጵያ ዋላ እንተተኸትመ እኳ ንድሕሪት ዝተረፈ መሪር ሓዘን ግን ኣሎ,0,0,0,0,1,0
tir_train_track_a_02740,ኢድካ ሃብ ኣንታ ጅሃጅ ሞትካ ቀሪባ ኢያ,0,1,0,0,0,0
tir_train_track_a_02741,አዋይ ክመርር ጽንዓት ይሓብኩብ  እዞም ኣራዊት ኤርትራ ክጭፍቸፉ አለዎም ህዝቢ ትግራይ ጽንዓት ይሃብኩም ካብ ኤርትር እየ,0,1,0,0,1,0
tir_train_track_a_02742,እታ ዓሌታዊት ጉጅለ PFDJ ንአብ ስደት ብጭንቀት ዝሳቀ ዘሎ ህዝቢ ኣኪቡ ኩራዕ ኩራዕ ከብሎ ዳስ ፈሪሱኒ ኢሉ የእዊ እታ ቁንጮ ዓሌታዊት ጉጅለ ተቃማሪት ውን ንህዝቢ ኣኪባ ዳውን,1,1,0,0,0,0
tir_train_track_a_02743,oh መሕዘኒ እዩ ! ደቀንስትዮ ትግራይ እንተተኻኢሉ ደቂ ዓድኽን ተመርዐዋ!,0,0,0,0,1,1
tir_train_track_a_02744,Richard Pankhurst ብዛዕባ ጥሜት ትግራይ (ብምኒሊክ ዝነበረ) ዝፀሓፎ እዩ ተዘኪሩኒ። እቶም ብሂወት ዝነበሩ ንሞት፣ እቶም ዝሞቱ ከዓ ንዝብኢ ይፅበዩ ነይሮም ዝብል።,0,0,0,0,1,0
tir_train_track_a_02745,ንፋሺሽት ዝድግፍ ገበነኛ እዩ,0,1,0,0,0,0
tir_train_track_a_02746,ቐለም ኰንካ ኣብ ልቢ ደቂ ሰባት ሓጎስ ክትጽሕፍ እተዘይኪኢልካ ብዝኮነ ተኣምር መደምሰስ ኮንካ ንሓዘኖም ኽትድምስስ ፈትን። ? ? ?,0,0,0,0,0,0
tir_train_track_a_02747,userqn1px2wd1e ማምሃራይ  ዲካ  ዋላስ  ትግራዋይ  ዶ  ናብ  ኣምሃራይ  ኢየ  ጽሂፈ  ዋላስ  መንነትኩም  ቀይርኩም  ኢኩም  ናብ  ኣምሃሩ  ቢኢኣምሃሪና  ከይትጽህፈለይ  ናይ  ጸላኢተይ  ቃንቃ  ኢዩ,0,1,0,0,0,0
