id,text,anger,disgust,fear,joy,sadness,surprise
tir_train_track_a_01785,እንዳ ፌስቡክ ሽግሮም ምሳይ ጥራይ ድዩ ወይስ ምስ ኩሉ እዮም ድምጺ ህዝብና ምግባር ክኽልክሉና ገሪሙና እኮ ሎምስ ።,0,0,0,0,0,1
tir_train_track_a_01786,ለባም ትግራዋይ ንመጀመርታ ግዜ ሎሚ ሰምዐ ንሰላም ዝፋጺ,0,0,0,0,0,1
tir_train_track_a_01787,ኣስተውዕል ኤርትራዊ ፈተውትኻ መሲሎም ሓራዲኻ ዝናፉቑ ካብ ታሪኾም ዘይመሃሩይገርም ?,0,1,0,0,0,0
tir_train_track_a_01788,ውይይ ትግራይ ዓደይ ኣታ ፈጣሪ ሰላምና እንዶ ምለሰልና ብጭንቀትን ናፍቖትን እባ ኣብ ዓዲ ሰብ ሞትኩ,0,0,0,0,1,0
tir_train_track_a_01789,ኣብዚ ዕለት 08 ሓምለ 2018፡ ቀሚ ኢትዮጲያ ኣቢዪ ኣሕመድ፡ ድሕሪ ናይ 20ዓመት ኣይሰላምኣይኲንት ሰንፈላል፡ ፋልማይ ናይ ሰላም ምጻሕ ንምፍጻም፡ ኣስመራ ዝኣተወሉን,0,0,0,0,0,0
tir_train_track_a_01790,ኣዝዩ መሪር ሓበን ሓፍተይ ?,0,0,0,0,1,0
tir_train_track_a_01791,ወዲ ወረደ ከምዚ ወሪዱ ምርኣይ ዝገርም እዩ። እጥቅና ቀልጢፍና ንፍታሕሞ ደጋዊ ሓይልታት ክወጹ እዮምያ ? እዚ ኩሉ ብርሰት ህዝቢ ትግራይ ብሰንኪ መን ከምዝመጸ እናበርሀ እዩ ዘሎ,0,0,0,0,0,1
tir_train_track_a_01792,ደምሒት፣ ትንሳኤ ኢሳያስ ኣብ ኲናት ክነብር ዝፈጠሮም ሓይልታት,0,1,0,0,0,0
tir_train_track_a_01793,ጽቡቕ ተበጉሶ ቀጽሉሉ ክሳብ ትግራይ ናጻን ልእላዊትን ሃገር ንውንን ሰም ከየበልና ቃልስና ነዐውት  ትግራይ ብደቃ ትዕወት,0,0,0,1,0,0
tir_train_track_a_01794,Justice4Tigray WeNeedRevolutionNotReform ህዝቢና ሰላም ዝረክብ ን50 ዓመታት ውላዳት ደቁ እናመንጠለት ዘፅነተቶ ህወሓት እንተጠፊኣ ጥራይ እዩ።,1,1,0,0,0,0
tir_train_track_a_01795,ሓደራ  ሓደራ  ሓደራ  ከውሊ ካብ ዓይኒ  ዝበሃል  ወታሃደራዊ  ስልቲ  ዘይምጥቃምኩም  ንዝኽፈል ዋጋ  የዛይዶ እዩ  ስለዚ  ሰራዊት  ትግራይ  ስቪል  ክዳን  ለቢሶም  ናብ  ኲናት  ምእታው  ጌጋ  ምኽንያቱ  ወተሃደራዊ  ኣልባሳት  ምስ ኩሉ  ናይ  በረኻ  ተፈጥሮ  ስለ ዘመሳስለካ  ጸላኢ  ብቐሊል  ክሪኤካ  ኣይክእልን  እዩ,0,0,1,0,0,0
tir_train_track_a_01796,ኢቲ ዘገርም ከምንፈልጦም ዘይፈልጡና ምኻኖም ኢዪ ግደፉ ኢባ ንሰላም ዘሚሩ Viva Eritrea ? ? ?,0,1,0,0,0,0
tir_train_track_a_01797,መግለፂዝሳኣንኩሉ ስእሊ ? መራሕቲ መንግስቲ ትግራይ ስቃ፥ መከራን ሞትን ህዝብና፤ንዲስጦጲያ በቢ 30 ዓመት እንኸፍሎ ዕቁብ ከመዘይኮነ ኣስሚሮም ክርድኡ ይግባእ።,0,0,0,0,1,0
tir_train_track_a_01798,ምስ ወያነ ኮይና ንህግደፍ ጸላኢትና ኢና ከነጥፍእ ንደሊ እምበር ወያነ ብህግደፍን ኣምሓራን ክትጠፍእ ኣይንደልንወያነ ክትጠፍእ ትደልዪ እንተኾይንኪ ምስ ህ,0,1,0,0,0,0
tir_train_track_a_01799,ጌታቸው ረዳ ኣታ ሓሣዊ ባንዳ ንህዝቢ ትግራይ ኮይንኻሉ ዕዳ ብናትኻ ሕሶት ብናትካ ፕሮፖጋንዳ መንእሰይ ትግራይ ተሪፉ ባሩ ሜዳ ኣዶ ትግራይ መኻን ኮይና ብወላዳ ደጊምዶ ተኸቢሩ በዓል ተወፂኡ ኣሸንዳ,1,1,0,0,0,0
tir_train_track_a_01800,ሓሙስ 31 መጋቢት ኣብ 10 30 ምሳና ሓቢርካ ፍትሓዊ ወርሒ መንበሪ ንምብዓል ከምኡውን ብዛዕባ እቲ ኣብ ማእከላይ ኣውራጃ ሲያትል ዘሎ ሃብትን ብድሆታትን ኣጋጣሚታትን ንምፍላጥ ምሳና,0,0,0,0,0,0
tir_train_track_a_01801,ኣታ ፃሕፃሒ ኣድጊ ? እኩያህን ፈልግ,1,1,0,0,0,0
tir_train_track_a_01802,tedrosberhane7073 እዚ ሊስትሮ ከልዮ ጥራይ ኣብዛ መድያ ውጥም ቂልክል ይበል ካልእ ዓቅሚ የብሉን ሓሶት ናይ ኣያታቱ ምድጋም እያ ዓቅሙ,0,1,0,0,0,0
tir_train_track_a_01803,እዚ ኹሉ ጠቐነን ዓይኒ ዘውፀአ ሓሶትን እቲ ግዝያዊ ምምሕዳር ትግራይ ክይጣይሽ ዝግበር ዘሎ ሽርሒ እዩ! Tigrai Tigray TDF Eritrea Ethiopia,1,0,0,0,0,0
tir_train_track_a_01804,ኦ ኣምላክ ንብዓት እቶም ህፃዉንቲን እቶም ዓበይትንርእኻ ምሕረትኻ ስደደልና,0,0,0,0,0,0
tir_train_track_a_01805,ብጣዕሚ እዩ ለህዝን ህዝብና ማኣዝ ካብ መከራ ይወፅእ ንጭነቅ ሓደ ሓደ ዘይረብሕ ወረ ምውራይ ይውዕሉ?,0,0,0,0,1,0
tir_train_track_a_01806,ሰላም tv ትግራይ ርእቶ ዋና ከተማ ትግራይ ክቕየር ኣለዎ ቦታ ኣብ ወርቃምባ ኮይኑ እስካብ ደብረዓንሳ ዘሎ መዳ ወርዒ ዲጋ ሰሪሕካ እኹል ዝስተማይ ካውሕስ ይኽእል ደብረዓንሳ ኣላዕሳ ቱነል ሰርሕካዓድዋ መቐለ 2ሳዓት ብመኪ ይኸውን ልዕሊኹሉ ጸላኢ ብቐሊሉ መንግስቲ ዉሕስነት ኣለዎ ብሕጂ ኣብትግራይ ሓዱሽ ገዛውቲ ኣብዛ ቦታዚኣ ክስራሕ ኣለዎ እምባ ወርቃምባ ልክዕ ከም ሓወልቲ ኣክሱም ክቕረጽ ኣለዎ መዘከርታ ንፉሉይ ሓይሊ TDF ትግራይ ትስዕር,0,0,0,0,0,0
tir_train_track_a_01807,ኑኡሳን ጕጅለታት ከምኡውን ኣብ ኢትዮጵያ ማሕበረሰብን ፖለቲካን ንምትእትታው ዝግበር ፃዕሪ,0,0,0,0,0,0
tir_train_track_a_01808,ናይ ሎሚ ቅነ ንፋስ ካኣ አንሆ ገለ ሰባት ሻቁሎት (ፍርሒ) ሉኡክ ህግደፍ ክከውን ይክአልዩ ዝብል ዘረባታት ይስማዕ ኣሎሞ ንስኩምከ አንታይ ትብልዎ ኣሎ?,0,0,1,0,0,0
tir_train_track_a_01809,userxl8xb1wq1t ካብዚ ዘለኩሞ  ዝከፍእ መዓት የውርድልኩም  ምበልኩኪ  ነይረ ግን ጽቡቅ ኣይኮንን  ብሰንኪ እዞም ዝጠቅሰልኪ ዘለኩ እንተ ብድንቁርና እንተ ንጽንተት ህዝቢ ትግራይ  ዝሰርሕ  ከም በዕል ሽፍታ ሽርዓት ዓድዋ  ብሰንኪ እዞም ሰባት እዚኦም ንህዝቢ ትግራይ  ሕማቅ ክምኒየሎም ኢልኪ ከይትሓስቢ  ዶንቆሮ,0,1,0,0,0,0
tir_train_track_a_01810,ሰላም ዘይደልዩ ተጋሩ ከም ዝህውትቱ ባዕሎም ይእመኑ ካብ ዘረበኦም,0,1,0,0,0,0
tir_train_track_a_01811,እንታይ እዩሞ ገሪሙካ ? ብግልፂ ነጥፈአኩም ኢና ይብሉናንአለው ንሕና ድማ ድርድር እናበና ንጠፍእ አለና እቲ ሽግር ካብ ባዕልናእዩ,0,0,0,0,0,1
tir_train_track_a_01812,ገሪሙና ኮ መስዋእቲ ዶ ቀሊል ጌራቶ  እህምም ኣይተተንከፈትን,0,0,0,0,1,1
tir_train_track_a_01813,እቶም ናይ አምሐራ ዓበይቴ እዮም ተገዲዶም እዮም አትበሉ ገና ናብ ኩናት ተይ አተዮ እናፈከሩ አይኮኑን ድዮም ዝመፁ ዘለዉ ምስ ተትሐዙ ተገዲድና ግርም,1,0,0,0,0,0
tir_train_track_a_01814,ኣበይ ኣለኩም ተጋሩ ያላ ንዑ,0,0,0,0,0,0
tir_train_track_a_01815,ብጣዕሚ ተሕዘን፡ ኣቦካ ዕዳ ይግደፈልካ፡ ደም ግን ኣይግደፈልካ ዝበሃል፡ ዘረባ ለባማት ኣሎ። ዓሊ ዓብዱ ክንድይ ሰብ ዝድመየ ትዕቢተኛ ጉሒላ ነይሩ፡ ኣብ መወዳ,0,1,0,0,1,0
tir_train_track_a_01816,ኣብ ሰነ ዝገብሮ ገድሊ ንነጻነት፣ንልአላዊ፣ንክብሪ ኣብ ሰነ ዝገብሮ ፍቕሪ ንፍርያት፣ንሰብሊ፣ንተኽሊ።,0,0,0,0,0,0
tir_train_track_a_01817,ከመይ ጌርና ካብ ጸላኢቴኒ ንመሃር?,0,0,0,0,0,0
tir_train_track_a_01818,ሰላም ልኡል እግዚአብሔር ምስ ኩላትኩም ይኩን ደቂ ተዋህዶ ተጋሩ ኣሕዋተይ ንዑ ሓቢርና ንዘምር ከምኡ ድማ ነቲ ውፁዕ ህዝብና ድምፂ ንኩን ዝተባረከ ጉባኤ ይግበረልና ኣሜን ኣሜን ኣሜን,0,0,0,0,0,0
tir_train_track_a_01819,ወረርቲ ሰራዊት ሻዓብያን ፋኖንን ኣብ ውሽጢ ትግራይ ኣትዮም ህዝብና እንዳጨፍጨፍ ኣብዘለውሉ ግዜ TDF ካብ ፅባሕ ዕጥቁ ክፈትሕ እዩ ዝብል ዜና ክትሰምዕ ከለካ ብጣዕሚ የሕምም,1,0,0,0,1,0
tir_train_track_a_01820,ብዛዕባ ህዝብና ወግሐ ጸብሐ ክሐስብ ከሎኹ ጏሂ ድንጋጸ ቁጥዐ ብኡኩቡ ብሐንሳብ ይስመዓኒ ንጥዕናይ ኢለ መሳኹቲ ዜናታት ዓጽየ ክርሕቕ ይውስን ግን ተስፋ ስለ ዝደሊ ድማ እን,1,0,0,0,1,0
tir_train_track_a_01821,ኺድ ናብ ሊብያ ስደተኛ,0,1,0,0,0,0
tir_train_track_a_01822,ምምምህዳር ሸራሮ ይበል ዘብል እዩ።ካብ ቀደሙ ምጡቅ ህዝብ እዩ።,0,0,0,1,0,0
tir_train_track_a_01823,Beautyinnature2 ንመን  ባርያ  ንዓይ  መን ኢዩ ንኤርትራዊ  ጅሃድ  ዝዘርግ  ሓሞቱ  ሓሞት  ብሓሞቱ  መሪር  ሓሞቱ  ንዓጋመ  ዝምንጥል እግሩን ክሳዱ  ኤርትራዊ  ጅሃድ  ዓወት  ዝልማዱ  እስከ  ቅልቅል  በላ  ኣትን ዓጋመ  ክሳድክም ክሳድ ዮሃንስ  ክንገብራ ሓደ ከይሃደመ  ኣሎና ጀሃዲስት  ሰፍና ወትሩ  ምስ ተሳሕሌ  ርእሲ ዘይብሉ ረሳ ክንሰድድ ናብ ማቀሌ,0,1,0,0,0,0
tir_train_track_a_01824,Ajoka heni ብጸሎት ብንኽእሎ ኣብ ጎንኻ ኢና,0,0,0,1,0,0
tir_train_track_a_01825,ትግራዋይ ጥምየት ይሞት ኣሎ::: እን ፀጊቦም ዝሓድሩ,0,0,0,0,1,0
tir_train_track_a_01826,ኣብዚ ናተይ ሪኢቶ ተቃውሞ ትህቡ ዘለኩም ቅልውላው መንነት ከም ኢሳያስ ዘለኩም ኢኩም ሸውዓተ ዓሌትኩም ኣብ ኤርትራ ዘይብልኩም ኢኩም ኮይኑ ግን ተጋሩ ኣብ ዓዶም ኮይኖም እዮም ድላዮም ዝዛረቡ ዝጽሕፉን ኤርትራውያን ግን መብቲ የብልናን ክንጽሕፍ ክንዛረብ ብዓቢኡ ድማ ኢንተርነት የለን ልቺ የለን,0,1,0,0,0,0
tir_train_track_a_01827,ሕማቅ ስማዕ ቀልቲፍና ብጣዕሚ ዘሕዝን,0,0,0,0,1,0
tir_train_track_a_01828,እዚኣ ብልክዕ ንመራሕቲ ህዋሓት ኣብ ልዕሊ ህግደፍ ዘለዎም ጌጋ ኣጠማምታ እትገልጽ ኢያ። ንሳቶም ህግደፍ ከም ቀንዲ ጸላኢ ክሳብ እዛ ሰዓት ሪኤሞ ኣይፈልጡን ኢዮም። ብሰንኩ ከኣ ንህዝ,0,1,0,0,0,0
tir_train_track_a_01829,ሳጥናኤል ተስፋ የብሉን ተስፋ ክኣ ኣይቆርጽን እዩ ዝበሃል። ልክዕ ከም ወያነማለሊት። ማለሊት ሓላሚት ሓሪሳን ነጊዳን ዘይትበልዕ ከዳሚት ወኻርያ፡ገጨጭ ካብ ኣራዊት ብቑዱሳን ትምሕል,0,1,0,0,0,0
tir_train_track_a_01830,እፍፍ አይ ትግራይ ዓደይ ማርያም አኩሱም ሓልውለይ  ብሰላም ድምጽ በተሰብና የስምዐና አብ ስደት ዘለና ተጋሩ አሕዋተይ,0,0,0,0,1,0
tir_train_track_a_01831,ብጣዕሚ ዘገርም ምረት ሓሊፍዎም ክሳብ ንዓድና ምለሱና ዝብሉ ኮይኖም ኤርትራውያን ስደተናታት ኣብ ኢትዮጵያ። ድምጺንኹኖም ኤርትራ,0,0,0,0,1,1
tir_train_track_a_01832,ሓሶት ዝወፀ ፋኖ የለን ጭራሽ ክሳብ ኣኽሱም እናመፁ ።ናይ ኣብይ ፕሮፓጋንዲስት እዩ ።,0,1,0,0,0,0
tir_train_track_a_01833,ወያኔ ብኽፍኣተ ግብራ ምቕባራ ዘይተርፍ ኣብ 1997 ወግዓዊ ባጤራና ክቕየር ከሎ ከምኡውን ቅዋምና ጸዲቑ ኣብ ምትግባር ህዝብን መንግስትን ኤርትራ ላዕልን ታሕትን እናበለ ዕማምና,0,1,0,0,0,0
tir_train_track_a_01834,ከይሞትካ ዓወት የለን እና ኣይዞኩም ደቂ ታ ዘይነፅፍ ማሃፀና ኣብ ስደት ዘለና ደቅኩም ብኩሉ ዓይነት መዳይ ኣለና ምስ ህዝብናን መራሕትናን ትግራይ ትስዕር,1,0,0,0,1,0
tir_train_track_a_01835,እቲ ሓሶት ህቢን ዓለመ እንዳ ራኣየት ብሕስወት ዓይኒ ተጋሩ ኽዕምት ይኽእል ኣባይታ ዘሎ ግን ካልእ ኣዩ,0,1,0,0,0,0
tir_train_track_a_01836,አንታ ሕሱር ሓርናጽ ተረፍ መረፍ ደርጊ መንነት አልቦ ዓጋመጎይታኻ ኢዩ  ከልቢስያ ጎይትኡ እምበር ጎይታ ጎይትኡን አይፈልጥ  ንስኻ ትፈልጥ ጎይታኻ አረጊት ሸይጣን ኢሳያስ አፈጭርቂ ጥራይ ኢኻ ትፈልጥ ናይ አቦኻ መዳሓንቲ ትቀበረሉ ቦታ እውን አይትፈልጥን  አንታ ውላጅ ሰራቒ ቴኖ ብጫ ጀሪካን መስሓን ሬሳኻ ይግበሮ  መናጢ,0,1,0,0,0,0
tir_train_track_a_01837,ኣየ ቅልውላው መንነት! ፈጣሪ ይውሰደኩም ጋለሞታ,1,0,0,0,0,0
tir_train_track_a_01838,ብጣዕሚ ዝገርም ማዓልቲ እያ ነይራ  ብፍላይ ንዓና ኣብ ወፂኢ እንርከብ ተጋሩ  እዛ ደርፍን እዛ ማዕልትን  ኣብ ልብናን  ኣብ ደምናን ይነብራ ኣለዋ  እቱ ዝገርም እቶም ዝስዕስዑ ዝነበሩ ኩሎም ኢና ንፈልጦም ኩሉ ግዘ ምሳና እዮም ኣብ ምንቅስቓስና ከይተፈለዮ መፅዮም  ኣነ አብሂወተይ ተስፋ ዝረኸብኩላ ማዕልቲን ግዘን እያ ነይራ  መቼም ትግራዋይ እዛ ደርፍን ወፍሪ አሉላ ክርስዕ ምሕሳብ ዘይኸውን እዩሞ የቐንየልና ሓውናን ሓታቲ,0,0,0,1,0,0
tir_train_track_a_01839,ሻዕብያ ከጥፍኣኩም ዲኩም ስቅ ኢልኩም ትጽበዩዎ ዘለኹም። ሻዕብያ ንህዝቢ ትግራይ ንምጥፋእ ደቂሱ ኣይፈልጥን ግደፉ ከይቀደመኩም ቀድሙዎ,0,1,0,0,0,0
tir_train_track_a_01840,ዘገርም ኢዩ ናይዚ ኣቶም ብዕድመ ዓበይቲ ዝባሃሉ ድሕሪ አዚ ሽግር ሓሶት ክምህዙን ከቃሉሁን ምቅጻሎም አዚ ዝተፈብረኸ ሓሶት ቅንጣም አትኣክል ብጀካ ሞትን ስዕረትን ዕንወትን ኣብ መወዳ አታ ካኣ ዕጥቂ ምፍታሕ ኢድካ ምሃብ ለሚንካ ምሓሩኒ ምባል ሰላም ኮይኑ ህዝቢ ትግራይ ነጻ ወጺኡ ደስ ይብል ንስኻት ግን ካብ አዚ ኩሉ ሂወት ክጠፍ አ ዝገብርኩም ስለ  ዝኾንኩም ተሓተትኪ ኢኹም,1,0,0,0,0,1
tir_train_track_a_01841,ጽንዓት ይሃብካ፣ ኣብ ቀብሪቶም ፍቱሓት ስረ ድማ የውዕልካ።,0,0,0,0,1,0
tir_train_track_a_01842,ናይ ስልጣን ጭንቀት እዩ ዘለዎምእዚኦም,1,0,0,0,0,0
tir_train_track_a_01843,ብጣዕሚ ዝገርም እዩ ኤርትራውያን አፍኩም መሊእኹም ከይሐፈርኩም እቲ ሕማቕን ነውራምን ዝኾነ ተግባርኩም ሐቢእኹም ናይ ተጋሩ ጌጋ እንዳምሰልኩም ተቕርቡ  እቲ ሐቂ ግን ንሕና ንፈልጦ ንስኹምውን ትፈልጥዎ ሕጽር ብዝበለ ንምግላጽ ውግዕ ዝጀመርኩም ባዕልኹም አብ መሬትና አቲኹም መቕለ ትቤት ዝደብደብኩም ተጋሩ ቀቲልኩም ቆራሪጽኩም አብ ኮንተይነር ዝደርበኹም ወዘተ እቲ ክሪሚናል ዝኾነ ተግባርኩም ኩሉ ምዝርዛር ይከአል እዩ ግን ግዜ ይወስድ  እሞ ጭ,0,1,0,0,0,1
tir_train_track_a_01844,lemred9733ትግርኛኹም መቸም ለቓቅብ አንዲኻ ትርድኦ በሊ ዘመኑ ሃመማሃመማ ዝብለሉ ግዜ እንድዩ ዘገርም ኣይኮነን ትግራዋይ ሃመማ አንተኢልካ ምረቃ አዩ ዝገርም ግን 1ሚልዮን ተጋሩ icecream  ሕዞም ናብ ኤርትራ ተበጊሶም ኢኺ ትብሊ ዘለኺ በሊ ኤርትራ ድማ grave flowers ሂባቶም ኣላ እልፊ ርእሲ ሓምሓም ሲ ምስ ኤርትራዊ ክትዛረቢ ድፊርኪ ኣብ ትግራይ አኮ ትማሊ ኣይፍለጥ ጽባሕ ኣይፍለይጥዩ ልቢ ትግራይ ዝበሃ,0,1,0,0,0,0
tir_train_track_a_01845,ናይ ብሓቂ! ዓለምና ፍትሒ ጨፍሊቖም ብእንቅዓ ሓሶትን ኽፋእ ግብርን መሰል ምግሃስን ዝኣምኑ ትምራሕ ስለዘላዩምበር እዞም ኣካልዑስባት እዚ ኣካይዳ ዓቀይ,0,1,0,0,0,0
tir_train_track_a_01846,ንስኻ ድኣ ፅቡቅ ትህልውን ፈረቃን ህዝበይ እምበር ኣንፅንትካዮ ኣታ ጨካን ኣረሜኒ  እቲ መንግስቲ ትግራይ ግን እቶምዝሞቱ ንዕቀት ድዩ ክንድዚ ዝደፈረን ዝቀተለን ምስ ሃገሩ ክእሰር ዓገብ ሓቂ ፍረዱ ኣምላኽ ከይፈርደኩም,1,1,0,0,0,0
tir_train_track_a_01847,እዋይ ኢስያስ ህልም የብልካ ናብዘይ ኣትወ ዘይብሉ,0,1,0,0,0,0
tir_train_track_a_01848,ሰላም ሰላም ሰላም ይብሉና መንግስቲ ትግራይ ሰላምመጺእ ኮ ህጊ እንትክበሪን ንኹሉ ብልክዕ ክፍረድ ጥራህ እዩ 12 ሚሊዮን ጨፍጭፈምልና ናይ ኤርትራ ሰራዊት 28 ቢሊዮን ዶላር ንብረት ሰርቆምና ሱቅ በሉ አይባሕልን,1,1,0,0,0,0
tir_train_track_a_01849,? ናይ አይተ ልደቱ ግምታት 3ተ ናተይ ለ ግምት እዩ ። ንምንታይ ይሕመና ካብዚ ወጻእይ ካልእ ክኮን አይክእልና እዩ,0,0,0,0,0,0
tir_train_track_a_01850,ሰሚዐያ ዘይፈልጥ ደርፊ! ዘገርም እዩ!,0,0,0,0,0,1
tir_train_track_a_01851,ጸላእቲ ካብ መዳፍዕ ሻዕብያ ስቅታ ሻዕብያ ዩ ዝያዳ ራዕዲ ዝፈጥረሎም ።,0,1,0,0,0,0
tir_train_track_a_01852,መርዚ ህወሓት ክለቅቕ ኣይከኣለን,0,1,0,0,0,0
tir_train_track_a_01853,ፍቕሪ 'ስነ-ህይወታዊ ጉቦ' ድዩ?,0,0,0,0,0,0
tir_train_track_a_01854,ነዲኡን ህዝቡን ተጋዲሉ ኣዲኡ ዘየድሐነ ቑርስስ ወለዶ ስድርኡን ህዝቡን ካብ ፀገም ከናግፍ ተጋዲሉ እንተብቅዕ ብኣጋጣሚ መቐለ ተመዲቡ ክዘዋወር ሃንደበት ኣዲኡ ዕሸላት ኣሕ,1,0,0,0,1,0
tir_train_track_a_01855,ኤርትራ፡ ኣብ ስልጠና ዝጸንሑ ወተሃደራት ሶማልያ ናብ ሃገሮም ተመሊሶም,0,0,0,0,0,0
tir_train_track_a_01856,ኣይዞኩም ደቂ ሓራስ ነብሪ ትግራይ ክትዕወት አያ ብደቃ ከምቶም ቀዳሞት ደቃ ህዝቢ ትግራይ ኩሉ ግዜ ዓወት አዩ ድራሩ ፅላሉ የምብረልኩ አየሱስ ክርስቶስ ኣቦና,0,0,0,0,0,0
tir_train_track_a_01857,ሕጂ ግርም መስጣ ጸሊም ክወርዶም አዩ,0,0,0,1,0,0
tir_train_track_a_01858,ቅድሚ ሒደት መዓልታት እዚኣ ኣብ ፌስቡክ መረባ ፅሒፈ ነይረ ምስ ኮነ ሃንደበት ከይኾነና ኢለ እየ,0,0,0,0,0,0
tir_train_track_a_01859,እቲ ቁጽሪ እና ዘለልካ ካብ 44 ናብ 11 እንዳ በልካ ወዲእካዮሞ ካብ ሓደ ክረኽቦም ተጸብየስ ኣይረኽብክዎምን። ዘፍርሕን ጽቡቅ ስራሕን!,0,0,1,1,0,0
tir_train_track_a_01860,ኣንታ ናበይ ኢና ንኸዶ ሎምስ ኡፍፍ ንሕናስ ዘይምፍጣር ምሓሸና ን ስቃይ ዝተፈጠርና ህዝቢ,0,0,0,0,1,0
tir_train_track_a_01861,ደቀንስትዮ ተሳተፍቲይ ኣብ ኣድፐርታይዝ ብዘይ ምህላወን የንቅፈኩም ኢዩ ዳግመግምት ግበሩ ጽቡቅ ትጉዓዙ ኣለኹም ካብዚይ ንላኢሊይ ክትሕዩሉ ንምነየልኩም,0,0,0,0,0,0
tir_train_track_a_01862,ኣንታ ግደፍዎም እንዶ ሳዕሲዖም ባዕሎም ደኺሞም ክገድፍዎ እንድዮም። ብሳዕሲዒት ኣበይ ከይበጽሑ ኢዮም።,1,0,0,0,0,0
tir_train_track_a_01863,አረ ትግራዋይ ምሁርን ፖለቲከኛን  እዙ ናይ ኣቦይ ስብሓት ትንታነ ቀልብኹም ኣኪብኩም ብደምቢ ስምዕዎ ብደምቢ እውን ሕሰብሉ ሓደ ነገር ንምግላፅ መለስ ዜናዊ ክሳብ መጨረሻ ምስ ኣቦይ ስብሓት ምጉዓዙ ብዘይ ሓደ ነገር ኣይኮነን ምስ እኒ ኣለም ገብረዋህድን ኣባይ ወልዱን ዕንኪሊል ምባል ይኣክል ብዝባን ስውኣትን ብዝባን ኣካል ጉድኣትን ቀልዲ ይኣክል ሓደራእዚጉዳይ ንጊዜያዊ ምምሕዳር ትግራይ ጌታቸው ረዳን ንኣቦ መንበር ሕወሓት ዶር ደብረ,0,0,0,0,0,0
tir_train_track_a_01864,solomonteshagerethiopian6483 ዕልልመጀመሪያ እንቋዕ ኣብፀሓኹም ንዘላለማዊ ሓዘንን ቁዛመን ቃንዛ ስቃይ መርድእ ናብ ሲኦል ጋሃንብ ዝኣቱ more than 15 million Rest in HELLፍጥረት ናይ ሰብ ዘይብሎም ዕቡድ ኸልቢ ዝለሃሶም ብመንፈስ ዕቡድ ኸልቢ ዝተጠመቁ ዝተለኸፉ ዝተበኸሉ  ንሞት እምበር ንምንባር  ዘይተዓደሉ ተጎቢሆም ብመኣኮሮም ብኣፎም ይዉገሩ ብበረኺና ብኣሲድ ተሓፂቡ ዘይጸርይ ጥላም ጥ,0,1,0,1,0,0
tir_train_track_a_01865,መወዳእታቶም ክልተ ከዋኽብቲ ብቀሺ ኣፈወርቂ via,0,0,0,0,0,0
tir_train_track_a_01866,ግምትካ ግምት ጥርሕ እዮም ክምልስዋ ዝኽእሉ,0,0,0,0,0,0
tir_train_track_a_01867,እሞ ዘለካ ሓበሬታ እንዶ ንገረና። ዋላ ብ Inbox እንዶ ስደደለይ።,0,0,0,0,0,0
tir_train_track_a_01868,መልእኽቲ ጽሑፍካ ንመዘክር ንምውቃስ ኣይኮነንንን፡፡፡ እዚ ዝደራደር ዘሎ ህወሓት እምበር ግዝያዊ መንግስቲ ኣይኮነንንን ንምባል ደሊኻ ኢኻ። ህዝቢ ዘገድሶ ግን መን ይደራደር ዘይኮነስ ንዓዲ ዝጠቅም ድርድር ምግባር እዩ። ንስኻ ግን ናይ ህወሓት ጉዳይ ጥራሕ እዩ ዘገድሰካ።,1,0,0,0,0,0
tir_train_track_a_01869,ኣብ ኦክስፎርድ ዝፈረየ ክታበት ኣስትራዘኔካ ኣብ ዓባይ ብሪጣንያ ኣብ መዓላ ክውዕል ፈቃድ ረኺቡ,0,0,0,0,0,0
tir_train_track_a_01870,ክብሪ ይሃበልና  ዝገርም ታሪክ እዮ ጀግና ሓውናእንኳዕ ደሞ ብሂወት ተርፍካ ክቡር ሓውና,0,0,0,1,0,0
tir_train_track_a_01871,ሓንሳብ ተፈጢሩኮ፥ ክንድዚ ዕንወት፥ ስደት፥ ሞት፥ ማእሰርቲን ዓመጽን ዘውረደሲካልኣይ፥ ሳልሳይ ተፈጢሩ እንታይ ጽቡቅዩ ክፍሪ። ብካ እቲ ሓንሳብውን፥ ከይተፈጥረ ተሪፉ!,0,1,0,0,0,0
tir_train_track_a_01872,ክሳብ ሐዚ ካብ ህወሓት ዝሐሸ ፓርቲ የለንብፍላይ ዶር  አረጋዉን ንሶም ዝመርሕዎን ፓርቲ ክምረፅ ኣይኽእልንባንዳ ድማ ቀደም ነይሩ ሐዚ ንስኹም ኣለኹም,0,1,0,0,0,0
tir_train_track_a_01873,ሰብ እምበር ሰብኣውነት ዘይረኣየሉ ናይ ጨካናት ዘመን ርህራሄን ፍርሃት እግዚኣብሔርን ዝጠፍኣሉ ወቕቲ! እዚ ዓይነት ዘስካሕክሕ ግፍዒ ከምዚ ዓይነት ጭካነ ደቂ ሰባት፡ ሰብ ምዃን,1,0,0,0,1,0
tir_train_track_a_01874,ብዝተራቐቐ ምትላል ዝተጓሃሃረ ስኑዕ ዕላል ጾታዊ ርክብ,0,0,0,0,0,0
tir_train_track_a_01875,ፕረዚደንት ኢሳይያስ ቀዳማይ ሚኒስተር ኣብይን ኣብ ግብጺ ተራኺቦም,0,0,0,0,0,0
tir_train_track_a_01876,ታሪኽ ናይ ብዓል ሕንኪሊፖስ ፡ ናይ ስርቂን ሓሶትን ስለዝኾነ እቶም ማሕዮ ኩርዑሉ። እቶም ጀጋኑና ንፈልጦምን ነለ,0,1,0,0,0,0
tir_train_track_a_01877,Abiy  dea felaleka  megzae  ዝብል ተንኮል ሒዙ  ትደልዮ ንክትረኪብ  ኣድላይ ሰብ ምንኣድ  ግድን  አዩ ክጥቀም  ተጋሩ የሕዋትና ከኣ ከይትዝንግዑ  አዚ  ንአሰያስ  አካ ናይ ሰላም ሰብ አዩ ከብሎ ዘይሓፍረ ዶ  ከምዚ ምባል ክሓፍር  ተጠንቀቁ  ገና 2 ግዝየ  ከነዛርቦም ኢና ዶ በልኩም  10 gzye kezarbu eyom  ሓውኩም eritrawi ደላዪ ሰላም ህዝቢ ቲግራይን  ህዝቢ አሪትራን አየ,0,0,1,0,0,0
tir_train_track_a_01878,ኣቱም ሰባት tplf ኮነ ግምት ሓደ እዮምዋ ጥራሕ ሰላም የምጽኡልና ናይ ስልጣን ጽምኣት ዘለኩም ንዝሳቀ ዘሎ ህዝቢ ሕሰብሉ ኩሉ ግዚየ ናይ ስልጣን ዝሓዘ ደገፍቲ ኣይትኩኑ ንህዝቢ ሕለይሉ,1,0,0,0,1,0
tir_train_track_a_01879,ጸሎት ኃይሊ ኣጋንንቲ ኣድኪምና ካብ ፈተናን መከራን ንድኅን፤ ካብ እግዚአብሔር ዘድልየናን ዚጐደለናን ሓቲትና እንቕበለሉ (ማቴ 7፡7) መንፈሳዊ ግብሪ እዩ። ናይ ፀጋ ብዓ,0,0,0,0,0,0
