id,text,anger,disgust,fear,joy,sadness,surprise
tir_train_track_a_00935,ቃንዛ ህዝቡ ዝፈልጥሽግር ህዝቡ ዝርድኦ ስነ ጥበባዊእቲ ሓቂ ኣውጺእዎ ኣሎዲያስፖራ ተጋሩህዝብኹም ኣብ ጥሜትን ዓጸቦን ከሎብሰንኪ መሪሕነት ምስ ጎሮባብቱ ኣብ ጽልኢ ኣትዩ ከሎፖለቲካ ኣብ ልዕሊ ህዝብኹም ደው ኣቢልኩምኣብ ጎኒ ህዝብኹም ኩኑንሰላም ዘምሩ ይኣኽሎ እቲ ውጹዕ ህዝቢ ትግራይ,0,0,0,0,0,0
tir_train_track_a_00936,ኤትዮጵያ ንህዝባ ዘትኮነት፣ ህዝባ ብልማኖ ሕማም፡ ሕድሕድ ኲናት ዝጣፋእ ዘሎ፣ ንህዝቢ ኤሪትራን ንህዝቢ ትግራይን ክትጽንብር ዓቅሚ የብላን።,0,1,0,0,0,0
tir_train_track_a_00937,1) ሓምድ ኢድሪስ ዓዋተ ተ ተ ተ ተ ፡ ቃልሲ ቦኪርካዮ ኩሉ ከይ ከተተ፡ ብእንኮ ኣቡ ዓሽራ ካላሽን ከይኣተ፡ ባሕቲ መስከረም ኣርኣኻዮ ንጸላኢ ትርኢተ፡ ተኲስካያ ፈላሚት ጥይተ፡,0,0,0,1,0,0
tir_train_track_a_00938,ንልዕሊ 20 ዓመታት ዓድኻ ከይተልምዕን ከይትልውጥን ክፍኣት እናፈተልካ ኣሕሊፍካዮ፣ ኣጋጣሚ ምስ ምስረኸብካ ድማ ናብ ሙሉእ ትግራይ ኣቲኻ ልዕሊ 42 ክሰራዊት ኣዋፊርካ ኣብ ዓለም ተ,0,1,0,0,0,0
tir_train_track_a_00939,ኣየ ተጋሩ ዕላማ ዘይብሉ ኩናት ባዕሎም ከፊቶም ብለይቲ ዓዲ ሰላም ኣሎ ኣብ ዓድና ኢና ኢሎም ልቦም ኣውዲቆም ዝደቀሱ ናይ ሰሜን እዚ ሰራዊትን መካናይዝድን ኣጥቂዕኩሞም ቅድሚ እዚ ምምጽኡ ብኽብረት ብዓበይቲ ዓዲን ጳጳሳትን መሻይኽን ኣብ ክልልኩም መጽዮም ኣብ ብርኩኹም ተደፊኦም ኩናት ጽቡቅ ኣይኮነን ግደፉ ኢሎም ለሚኖምኹም ብጽጋብኩም ከኣ ኩናት ባህላዊ ጨወተና ኢዩ ኢልኩም ድማ እንሆ እዚ ኩሉ ካብ 100መንእሰይ ኣጥፊእኩም መወዳእታ,0,1,0,0,0,0
tir_train_track_a_00940,ሓጎስ ኣየሃብካ ወዲ በካዕ እንታዴኻ ከደስካ ብዛዕባ ናይ ኤረትራ ነቶም ደቀባት እዩ ዘሕገሰና እምበር ንዓኻ ኣይምልከተካን,0,1,0,0,0,0
tir_train_track_a_00941,ኣበይ ትራኺብና ትብል ዳኣ  እቲ ጻድቃን ዶ  ቆልቋል ዝብሃል ዶ  ምስ ብርሃኑ ጁላ ተራኽብና  ሻዕብያ  ከውጻኡልና  ዝብሃል ሃለው ዶ ኣይበልን ተግልበጠኒ በል ሃንዛ  እዞም ትግራይ እኮ ስግር ኮንኩምና ንሕና ህጅስ ደብርጼን ዲኻ ህጂ ትሕሱ ዘለኻ ውላስ ቀደም ኢኹም ሓስኹም ኩሉ እቲ ዜናታትን ሓሶትን ባዕልኹም ኢኹም ከይወግሀ ጽባሕ ድኣ  ተተ ረዳ  ዘተ ጽቡቕ ይኸይድ ኣሎ ከይብል እምበር,0,1,0,0,0,0
tir_train_track_a_00942,ዝፀልኦ ናይ ትግራይ ደረፊ ረሳሕ ክንደይ ንፍዓት ጥዑም ደርፊ ባዓል ደኩተር ኪሮስ ኣለማዮህ ንግስቲ ሓዮሎም ናይ ትግሪኛ ደርፊ ናይ ትግራይ ናይ ወግእ ደርፍታት ናይ ፍቅር ዝስማዕ የለን ትብል ጉኑፍ ጨናዊ,0,1,0,0,0,0
tir_train_track_a_00943,ሻዕቢያ ማለት ኮ እንስሳ መሃይም ኣራዊት ማለት ዩ  ይትረፍ ዶ ሰብ ጋል ሰብ ረኺብኩም  ኣባጊዕን አእድጉን ትሰሩ ዝነበርኩም ፍጥረት ስብ ዘይብልኩም እኽብካብ ደቂ መበለት  ደቅ ሸራሙጥ ኢኹም ንኹሉ መዓልቲ ኣለዎ መዓልትኻ ተጸበ እንታ ብስብስ ብርጌድ ንሓመዱ,0,1,0,0,0,0
tir_train_track_a_00944,ኤርትራውያን ስዴተኛታት ኣብ ቱንስያ፥ ልዕሊ 4 ዓመት ኣብ መከራን መግፋዕትን። ሕጂ ድማ ኣብ ጽርግያ ክሓድሩ ኤህ! ? ካብ ዕለት ናብ ዕለት ብፍርሒ ምንባር! Tunisia,0,0,0,0,1,0
tir_train_track_a_00945,ኣንታ በጃኻ ልቢ ግበር ፈቲኻ ጸሊእካ ንሃገረ ኤርትራ ብሰላም ትወዳደር ሃገር የላን ጽቡቅ ኣዛርቦ እቲ መልሓስካ!,1,0,0,0,0,0
tir_train_track_a_00946,00  ሓባል በሊያ ከይትቅድመኪ ኢዩ ናትኩም ህዝብና ደም ሸይኑ ዘምጽኦ ቃልሲ ሃገር ቁማር ኢልኩም ኣብ ዓለም ዘየለ ድሕረትን ጭኮናን ኣውርዲኩም ከይኣክል ከም ኮሞዴረ ዝሓመመት ማርሾ ንከባቢና ከይተረፈ እዙይ ዘይብሃል በደል ፈጺምኩምሲ ሰላም ከመይ ጌርካ ከምትዕቀብ ከተስትምህሩ ዝገርምዩ  ዓለም ድሕሪ እገዳ ኣበይ በጺሓ ኣይፈለጥኩማን በቃ ስብ ምቅታል ጥራይ ኢዩ ሞያኹም,0,1,0,0,0,0
tir_train_track_a_00947,ቁዱስ ሚካኤል እዩ ለማዓንቲ እሞ አለቃ ቁዱስ ሚካኤል ምሳኩም ይኩን  ብክንፉ ይከልክልኩም  ከምቲ ናሞት ደብዳበ ናብመርዓ ዝቀየረ ንዓኩም ድማ ንጥፍአት ኢሉ ዝመፀ ነጥፈኦም ኢሉ ዝሓሰበልኩም ኩሉ ቁዱስ ሚካኤል ንዓወት ይግበሮ,0,0,0,0,0,0
tir_train_track_a_00948,ትግራይ ትዕወት ሰላምን ቅሳነትን ህላውነትናን ብቕልጽምና ትግራይ ትስዕር,0,0,0,0,0,0
tir_train_track_a_00949,ዝኣኽለን ጥሒነን በዓለ ማርያም ይብላ ምስምስ ድሁላት ዓሳክር ብልፅግና ሻዕብያ,0,1,0,0,0,0
tir_train_track_a_00950,ናይ ኩላትና ግምት ነይሩ ግምት ጥራሕ ኮይኑ እምበር,0,0,0,0,1,0
tir_train_track_a_00951,መንሞ ከሰርሖ ኣብ ዕስለ ሰራቂን ጉጅለን ውሽጢ ተዋሒጡ ብዝተፈለየ መራሕትን ደገፍትን ናይቲ ዓመፀኛ ጉጅለ ቀይመኛ እናበሉ ከፀልምዎ ክትርኢ ከለካ ዞም ሰባት ንሰልጣኖም ክብሉ መልኣክ እውን ሸይጣን ኢሎም ከም ዘፀልምዎ ኣይትጠራጠርን,1,1,0,0,0,0
tir_train_track_a_00952,ክሳብ ሕጂ ህዝቢ ትግራይ ንግብረሽበራዊት ጭፍራ ውያነ ብጋህዲ ካብ ምኹናን ተቕጢቡ ጸኒሑ ፡ ከቢድ ክሳራ ኽኣ ኣጋጢሙዎ ይርከብ ሕጂ ግን ይኣክል ወያነ ምስ ድሑርን እዕናዊን ኣታሓሳስብ,0,1,0,0,0,0
tir_train_track_a_00953,ልብኻ ብሓጎስ ዝመልእ ቃለ መሕተት ምስ ስነ ጥበባዊ ተስፋይ ወዮሃንስ (ሓው ስነጥበባዊ ገጻዲቕ ወዮሃንስ) via,0,0,0,1,0,0
tir_train_track_a_00954,ናይ ህጂ ሀድሽ ዜና የብልክን ወልዲያ ብፋኖ ቁጽጽር ዊዒላ ኣላ ናይ አምሀራ ህዝቢ ጸላኢና ዶ ትብሉ ዶ አይ ነበርኩ ምን እንታይ ሀድሺ ነገር ተረኪቡ ክክ,0,1,0,0,0,0
tir_train_track_a_00955,ሰራዊት ኤርትራ ዝባሃል ብፍጹም የለን ። ውድቀት ንሰራዊት ኢሳያስ ፡ ጉልሕንጣ ህዝብን ሰላምን ።,1,1,0,0,0,0
tir_train_track_a_00956,አነ ይገርመኒ ንምንታይ ኢኩም ስብና ተጥፍእወለኩም ሕነ ዘይትፈድዩ ንምንታይ ሙርካት ናብ ምድያ ተውጽኡ,1,0,0,0,0,1
tir_train_track_a_00957,ብሓቒ ግን ትማሊ ብሕጊ ምኽባር ወገንካ ኣብ ምጥፋእ ዝወዓለ ሓይሊ ዶ ሎም ዘይሓገዝካኒ ምበለ ዋ shortmemory ኸይንኾን ባዕልና ንሰንድ ባች!?,1,0,0,0,0,0
tir_train_track_a_00958,ናይ GSTS ዘይሰማምዐሉ ነጥቢ ብዛዕባ ኣማኻሪ ምክርቤት ኣብግምት ተሓዚልካ ስልጣን ምምንዛዕ  መሰል ትግራዋይ ምግሃስ  አዩብናይ ኢሊት ኣማኻሪ ምኽርቤት ዲሞክራሲ ኣይረጋግፅንትግራይ ዘሎ ነብሲ ወከፍ ትግራዋይ ብካርዱ ዝመርፆ እዩ ክኸውን ዝግባዕዝኾነ ኢሊት ኣነ እዬ ዝፈልጠልካ እከለ እከለ ኢሉ ክመርፅ ንናይባዕሉ ዋኒኒ ክምስርት ዝመረፆ ከይዲ መሰል ዲሞክራሲ ህዝቢ ትግራይ ዝጥሓሰ እዩመሪሕነት ደኺሙ እትብሉ ተወዲብኹም ሓሳብኹም ን,0,0,0,0,0,0
tir_train_track_a_00959,mashogermedihin2055 አቲ ዘይናቱ ዝደሊ ወያኔ መሬት ኤርትራ ወሪሩ ባድመ ናይና እያ ኢሉ  ግን ሓሽዮምና ስዩም ንሕዝቢ ኣሕጉሱዎ ብሓሶት 20 ዓመት ድማ ዘይናቱ መሬት ወሪሩ ብናይ ኣሜሪካ ጸቅጢ ንኤርትራ ኣብ ሽግርን መከራን የእትዮማ ሕዝባ ድማ ተሰዲዱ ፋሕ ኢሉ ናብ ድኽነት መሊሶማ ድሕሪ እዚ ኹሉ ሻዕውያ እንታይ ዘይገበረ ደሊኺ መንግስቲ ዓድዋ ኣላግጩልና  ኣሕሕ ሕዝበይ,0,1,0,0,0,0
tir_train_track_a_00960,ትግራይ ዓዲ ተጋዳላይ ኣይግዛእን በሃላይ,0,0,0,1,0,0
tir_train_track_a_00961,እወ! እዚ ሓደ ኣረሜናዊ ተገባር ሓደ ካብቲ ናይቲ ኣብ ኣስመራ ዘሎ ጉጅለዩ፡ ኢሰያስ ካብ ቀደሙ ንህዝብን ደቀ ባትን ኤርትራ ንምጽናትን ንምብታን ዝተላኣኸ ነ,1,1,0,0,0,0
tir_train_track_a_00962,ኣበይ ክትህልዊ ደኣ ኣብ ዓዲ ሃገር እንዳተቀመጥኪ ሰላም ትባሃል የለን እዚ እክይ ህግደፈ ከይጠፈአ,0,1,0,0,0,0
tir_train_track_a_00963,LSAN MEDIA ብጣዕሚ ዘሰንብድ ኣጋጣሚ ዜና ዕረፍቲ ዓቢ ኣርቲስት ሲዒድ ኣንዋር ሎሚ ወጋሕታ ዕለት via,0,0,0,0,0,0
tir_train_track_a_00964,ይግስግስ አሎ ቲዲኤፍ አብ ውህድ ማአልቲ ህዝቢ  ትግራይ ክወግሀሉ ካብ  እፅዋን ጥምየትን ሞትን ክናገፍ ተስፋ ይገብር  አብ መላእ ኢዮ ዘሎ ትግራዋይ እውን ናይ ናፅነት አየር ክትፍስ ካም ማእሰርትን ምግፋእን ምግላል ምግልታእ ክወፅ ጀጋኑ አህዋቱን ደቁን ብዝከፈልዋ ስዋእቲ,0,0,0,1,0,0
tir_train_track_a_00965,ጭንቀት ሒዝካ ኣሎታ ውዒጊን! እቲ ዘስሕቕ ነገር ግን ንስኻ ሓደ ቃርማ ብዛዕባ ፕረዚደንት ኢሰያስ ክትዛረብ ምፍታንካዩ! ሕፈር ከይንብለካ እንዳ ውዒጊን መሕፈሪትኩም ተሰይራያ መንገርገርቲ።,0,1,0,0,0,0
tir_train_track_a_00966,ኤርትራውያን ኣብ ልዕሊ ተጋሩ ዝፈፀምዎ ግፍዒ ኣብ ዝኾነ ኣጋጣሚ ዝፍደ ዘይኮነስ ናይ ወለዶታት ኤርትራ ዘለኣለማዊ ናይ ሕሊና ሸኽሚ እዩ። ገለ ኤርትራውያን ምስ ናይ ኣምሓራ ሓይልታት እትውግኑ ዘለኹም ድማ ከይወግሐኩም።,0,1,0,0,0,0
tir_train_track_a_00967,እስራኤል፡ ኣብ ቓዛ 'ብኣየር፣ ብባሕርን ብመሬትን' መጥቃዕቲ ንምፍፃም ከምዝተዳለወት ኣፍሊጣ,0,0,0,0,0,0
tir_train_track_a_00968,ሓንኻስ እንተትሕባኣልካ ዶ በሉ። ነቶም ህወት ንጹሃት ክቀዝፍ ወይ ነቶም ንብረት እማቶም ክዘርፍ ዝሓገዩ ከንቱ ሞት ዝሞቱ ሰራዊት ኤርትራ ዳኣ ዘክሮም እወ።,0,1,0,0,0,0
tir_train_track_a_00969,ብቅትለት ጆርጅ ፍሎይድ ዝተጠርጠሩ ፖሊስ ናብ ቤት ፍርዲ ቀሪቦም,0,0,0,0,0,0
tir_train_track_a_00970,ሓሚሙ ኢልካ ከተብቅዕስ መሊስካ ከኣ ተሰዊኡ ዝገርም ዩ።,0,0,0,0,0,1
tir_train_track_a_00971,ጆርጂያ ካብ ሑቡራት ዓድታት ራሺያ ተነፂላ ዓርሳ ዝኸኣለት ሃገር እንትትኸውን ኣብ ቀረባ ኣዋርሕ ናብ ኤውሮጳዊ ሕብረት ክትፅምበር እያ። እቲ ዝገርም ድንግልና (ክብረንፅህና) መርዓት,0,0,0,0,0,1
tir_train_track_a_00972,ናይ ኣድጊ ይእተካ ወዲ ሙላቅ ኮንዶ እንታይ ኮይነ እልካ ትጻረፍ ኣለካ ንሓንቲ ተወለድቲ ገጠር ብ ውገእ ዝተሃሰዩ ሰለማዊያን ሰበት ምሕጋዝ እ,0,1,0,0,0,0
tir_train_track_a_00973,ውድብ መግቢ ዓለም ኣብ ኢትዮጵያ ንስደተኛታት ሓገዝ መግቢ ከቕርብ ጀሚሩ,0,0,0,0,0,0
tir_train_track_a_00974,ህወሓት ንህላወኣን ህላወ ወነንታን ክትብል ንኹሉ እያ ትኽሕድ። ብጥፍኣት ትግራይን ደቂ ትግራይን ህልውንኡ ዘቐፅል ውዳበ እዩ ህወሓት ማለት።,0,1,0,0,0,0
tir_train_track_a_00975,ብርስሓት ዝዐበኻ ንስኻ እንበር ዶክተር አብይ አይኮነን,0,1,0,0,0,0
tir_train_track_a_00976,ቅቅ ባዕሉ ደብረጭየን እድዩ ኩይናት ኣዊጁ ኣታ ህዝቢ ዓይትዕሹዉ ባዕሎም እድዮም ን ሰሜን ዕዝ ምክልልኻል  ዘስካሕክሕ ተግባር ጌሮም,0,1,0,0,0,0
tir_train_track_a_00977,ድንግል ማርያም ትግራይ ዓደይ ሓደራ ኣታ ኣነ ብጭንቀት ሞትኩ እፍፍ ኣምላኬ ሓደራካ,0,0,1,0,0,0
tir_train_track_a_00978,?ዘሕዝን ገበነኛ? ?ኣብዚ ሰለስተ መዓልቲ ኣብ መቐለ ዝተፈጸመ ኩነታት እዩ። ሓደ ወዲ ርእሰ መምህር እዩ። በዓልቲ ገዝኡ ሓሚማ ክሰርቕ ዝተተሓዘ። መሉእ,0,0,0,0,1,0
tir_train_track_a_00979,ዜናዊ ብጣዕሚ ዝገርም ደርፍ ኢካ ለቂቅኳ ብፍላይ ንኣሸንዳ ዝላኣለ ድምቀት ክህብ ኢለ ይኣምን ፅቡቅ ሰራህ እዮ በርት ጀግና,0,0,0,0,0,1
tir_train_track_a_00980,ኣንፃር ረብሓ ትግራይ ዝቃለስ ውድብ ህወሐት ብሞት ትግራዋይ ዝሽቅጡ መራሕቲ ህወሓት እዮም ስልጣን ዝልምኑ ዘለው ሙታን ካብ እንግድዓና እንትወርዱ ንመን ኢኻ ክትሕሸከር ?,1,1,0,0,0,0
tir_train_track_a_00981,እዞም ኣብ ጌቶ ዝዓበኩም ቆልዑ ድያስፖራPFdJ ምስ ታሪክና ምስ ሃገርና ምስ ስቃይ ህዝብና ወላሓንቲዩ ርክብ ዘይብልኩም ስለዚ እዚ ድርባይ ኢሳያስ ኣባኩም ምውዳቁ ዓቢ ዕድልን ዕጫን ህዝብና እዩ ።,0,1,0,0,0,0
tir_train_track_a_00982,SHAM Ab Sport ናይ ሰዓል ዝሓመመ ኣይኮነን ከምዝመስለኒ የ ርእይቶይ ኣቀሚጠ  ንስኻ ዘይኮንካ ድማ ቶም ቻነል ዮም መልሲ ክህቡና ዘለዎም,0,0,0,0,0,0
tir_train_track_a_00983,ልዕሊ 60 ስደተኛታት ኣብ ባሕሪ ጥሒሎም ከይዀኑ ተሰጊኡ,0,0,1,0,0,0
tir_train_track_a_00984,ዓለም ጨካን ያ እወ ጨካን ያ ፍትሒ ዘይብላ።,0,0,0,0,1,0
tir_train_track_a_00985,ድሕሪ ሰለፋ እንታይ ተረፋ ካን እዚ ህዝቢ ትግራይ ብመልሓስኩም ጥራይ ክታለል ክነብር ዝተፈረደ ህዝቢ እዩ ከመይ ዓይነት ንዕቐት ዩ ዘለኩም ኣብ ልዕሊ እዚ ህዝቢ በጃኹም ኣሜሪካ ክብል ዝውዕል ጃዕባብ መንእሰያት በሊዑ ክፍክር በዚ ሒዞሞ ግን ተሓቢእና ኢና ዘለና እዋይ ክልተ ሞት,0,1,0,0,0,0
tir_train_track_a_00986,ሞቓድሾ፡ ኣብ ዓለም 'ሓደገኛ’ ከተማ ዶ ወይስ ‘ሉል ህንዳዊ ውቅያኖስ’?,0,0,0,0,0,0
tir_train_track_a_00987,መጀመርታ ሰላም ምስ ነብስኺ ግበሪ። ካልኣይ ካብ ቅልውላው መንነት ውጺ። ሳልሳይ ምስቶም መቕርብኪ ኢትዮጵያውያን ተፋቐሪ። ራብዓይ እቲ ጌርክዩ ዘለኺ,0,1,0,0,0,0
tir_train_track_a_00988,እንታይ ኣራኸቦ ንወያነ ምጥፋእን ህዝቢ ትግራይ ግዳይ ሓሶት ሚድያታት ምግባርን ጆኖ ሓሶት እምበር ጆኖሳይድ ዝብሃል ኣይነበረን የሎን እይክህሉን ኡዩ ዋላ እኳ ወያነን ሰዓብቱን እንተደለይዎ,0,1,0,0,0,0
tir_train_track_a_00989,ብጣዕሚ ተሓዝን ማንም ንፖርቲ ኣይኮነይ ዝቃለስ ዘሎ ንህዝብ እዩ ከሙዙይ እልካ ምዝራብካ ግን ካብቶም ፀላዕትና ኣንዕስና ኣይንርኣካን ?,0,1,0,0,1,0
tir_train_track_a_00990,ሃገር ናይ መኒነት ዶ ናይ ዜግነት  ኣይትጋገ  መንእሰይ  ብናይ  ሓሶት  ታርኽ  ዝታለል  እንተዝከውን  ካብ ሻዕብያ  መራሕቲ  ንላዕሊ  ናይ  ሓሶትን  ፋብርካ  ዘላቶ  የሎን  እቲ  ዘገርም  ሻዕብያ  ሓያልን  ንህዝቢ  ኤርትራ  ከምዝፈልጦን  ክተእምን  ምፍታንካዩ  እወ  ኣልሽባብ  እውን  እኮ  ኣነ  ንኣመሪካ  ከይተርፈ  ዝስዕር  ሓያልየ  ዝብል  ሻዕብያ  ንህዝቢ  ኤርትራ  ከምዘይፈልጦ  ኣማኢት  ጭብጥታት  ኣሎ  ግን,1,0,0,0,0,1
tir_train_track_a_00991,መሳኪን ዶ በልካ ! አቶም ኣብ ዒራዒሮ ዘለዉዶስ አዚአም መሳኪን፡ ዝገርምዩ ምትኽኻአ ንሓድሽ ወለዶ ከምዝግብአ ኣይትዘንግዕ፡,1,0,0,0,0,0
tir_train_track_a_00992,ሐዝውን ትካላዊ ኣሰራርሓ ክሳብ ዘይተኣታተና እቲ ስርቂ ይኹን ሸፋፊንካ ምሕላፍ ቐፃሊ እዩ። ሐዚ ዝጀመረ ዘይምዃኑ ድማ መብዛሕትኡ ይርዳእ እዩ ስለዚ ከም ፅቡቕ ኣጋጣሚ ወሲድና ናብ ረብሓና እንለውጦ።,0,0,0,0,0,0
tir_train_track_a_00993,asmaerasmaer9441  ተዃን ደንብያ ፍንፉን ዓልየት  ይግልቡጡ እንበር ኣይግልበጡን ተጋሩ ደጋል ኤርትራዊ,0,1,0,0,0,0
tir_train_track_a_00994,‘ዘተ ሰላም ከይዕወት ዝገበረ መንግስቲ’ዩ’ - ሚኒስተር ታዬ ደንደአ,0,0,0,0,0,0
tir_train_track_a_00995,ጸሊሞይ ብዓልቲ ታሪኽ ንህዝብኺ ብርሃን ኢኺ እንተ ንጸላኢ ግን  ጸልማት ከዲንኪ አብ ትሕቴኺ አስፊርክዮም,0,0,0,1,0,0
tir_train_track_a_00996,እንኳዕ ተወለድኻ ጅግናና ወዲ ትግራይ ኩሕሎ?እንኳዕ እውን ትግራዋይ ኮንካልና!?ትግራይ ሰላም ኮይና ምስ ስድራኻን ሕዝብኻን እተኽብረሉ ይግበርካ!ኩሉ ትምኒትካ,0,0,0,1,0,0
tir_train_track_a_00997,ምእንቲ ዓድካ እዚ ኩሉ ፀገምን መከራን ተፃውርካ ተቃልስካ ኣብ መገዛእ ዓድካ ክትቅተል ኣይመተገበአካን? ሞትካ ፍትሒ ክረክብ እዩ ። ብሰላም ዕረፍ ? Thank you for your,0,0,0,0,1,0
tir_train_track_a_00998,ሰናይ ዝኮነ ዜና ብፍላይ 540 ኣስሚረላ ኣለኹ ቀጽልሉ ክኣ መሽረፈት ሌባ ካብ ስልጣን ከይወረደ ናይ ዩንቨርስቲ ጸገም ይኩን እዚ ዝሰርሖ ዘሎ ተዋስኦ ዝቅረፍ ኮይኑ ኣይስመዐንን ሶ ዳውን መሽረፈት መናፍቕ,0,1,0,1,0,0
tir_train_track_a_00999,ኣንጻር ኢትዮጵያ ንዝካየድ ዝነበረ ቃልሲ Eritreaያን ብሓደ ጭው ዝበለ ኢትዮጵያዊ ተመሪሑ ምእታው ዘገርምዶ ኣይኮነን ? ?,0,0,0,0,0,1
tir_train_track_a_01000,ኤህህ pseudo freedom fighter! ግፍዒ ኣብ ዝበፅሐ ይብፃሕ ክውገዝ ኣለዎ እንተ ንስኻ ግን ብሰራዊት ኤርትራ ኣብ ደቂ ኣንስዮ ስደተኛታትን ሓረስቶትን ተጋሩ ዝበፅሕ,0,0,0,0,1,0
tir_train_track_a_01001,ንዘመናት ዝጸንሐ ጽውጽዋይ ጾታዊ ርክብን ድንግልናን,0,0,0,0,0,0
tir_train_track_a_01002,ትግራይ ትስዕር ክሳዕ መጨረሽታ,1,0,0,0,0,0
tir_train_track_a_01003,እዚኣ'ውን ስልጣን ኮይናስ ቸነዲሩለይ🤔 ...ኣብ ትግባረ ... እዩ ዝብል ዘሎ፤ መንድዩ ኣብ ምትግባር እቲ ስምምምዕ ዝሃልኽ ዘሎ። ትማሊ ግዚያዊ መንግስቲ ከምዚ ዘይገበረ እንዳበልካ ትነብሕ ዝነበርካ ኣብ ግምት'ምበር ኣብ ህወሓት ኣይኮነን,1,0,0,0,0,0
tir_train_track_a_01004,ኣስይ  ሽኮር ጛልይ ንርእኪ  እውን ህጻን  ኢኪ  ብህጻንካ ዝወለድካ እንዳሐድረ ይሕጉስ ይብሉ ስድራን ኣጆኪ ክሐልፍ ኢዩ እንኻዕ ትርፍኪ  ኩሉ ክሕልፍ ኢዩ ከምዝይንብራ ክከውን ኢዩ ወይልኡ ዝሞት ዝሎ ኩሉ ክርእዮ  ኢዩ ኣጆኪ,0,0,0,0,0,0
tir_train_track_a_01005,ብ1983 መሬትና ዓደርቃይ ናትኩም እዩ ኢልና ስለዝገደፍናሎም ሎሚ ማይ ፀብሪ ሑመራ እውን ናትና እዩ ኢሎሙና ኣለውሃ ገዲፍናሎም ኣላማጣ እውን ናትና እዩ ኢሎሙና መሬትካ ሂብካ ዝመፅእ ሰላም ከምዘየለ ኣሪኦሙና,1,0,0,0,0,0
tir_train_track_a_01006,ዓወት ንህዝቢ ትግራይ ሞት ንሓሳዳትን ወረርቲ ፀላእቲ ህዝቢ ትግራይ,1,0,0,0,0,0
tir_train_track_a_01007,ህግደፍ ብሰላም ጥራሕ ን ዓድና ንቶ ሓንቲ ብሓንቲ ክንጻባጸብ ኢና ጸልማት መጻኢ ዲና ብሩህ መጻኢ ክነሬኤኩም ኢና።,0,1,0,0,0,0
tir_train_track_a_01008,ክንዲ ነዚ ህዝቢ ምድባስን ናብ ንቡር ክምለስ ኣድላይ ሓገዝ ምግባርን በቢ ጎቦታቱን ሽንጥሮታትን ዝረገፉ ደቁ ብስርዓት ሓዘን ክገብርን ብግልፂ መንርድእ ምንጋርን ህዝቢ ንምትላልን ከ,1,1,0,0,1,0
tir_train_track_a_01009,ኣወ ሓቅካ ስቃይን ሞትን ህዝቢ ትግራይ ኣይንታይካን ኣዩ !,1,0,0,0,0,0
tir_train_track_a_01010,ናትካ ኣይኮነን ዝገርም ናይቶም ንስካ ትመርሆም ኢዩ ዝገርም,0,0,0,0,0,1
tir_train_track_a_01011,ሕማም እዋን ጥንሲ መበገሲኡ እንታይ እዩ? መፍትሒኡ’ኸ?,0,0,0,0,0,0
tir_train_track_a_01012,ንደንቆሮ ይመስሎ እዩ።ንሓሰውቲ ከም እኒ ኣታኽልቲ ዝበሉ,1,1,0,0,0,0
tir_train_track_a_01013,Wellcome Timnit ጓል ሕዝቢ  እወ ክንነብር ኢና ንሞት ዝሰዓረ ኣይመውትን,0,0,0,1,0,0
tir_train_track_a_01014,ቅልውላው ትግራይ: ካብ ስልጣኖም ዝተወገዱ መራሕቲ ህወሓት ንሰላማዊ 'ዝርርብ ቅድመ-ኩነት ኣንቢሮም',0,0,0,0,0,0
tir_train_track_a_01015,ብስራት ገብረጅወርግስ ትብሃል ካብ ከተማ ሸራሮ ሰለስተ ርእሳ ተገፊፋ ናብ ኣዋሽ ኣርባ ዝወስደት ሲቪል እያ ብመልክዕ ሙርከኛ ዝተመለሰት። ኣይ ፓለቲካ መሕዘኒ,0,0,0,0,1,0
tir_train_track_a_01016,ሕዋህት ንምፍራስ ናታን ዘይናታን ስም ምጥፋእ እበር ተወዲብና ፀላእትና ከንከላኽል አይገበርን ሕዝቢ ትግራይ በዘይ ጠንካራ መሪሕ ዉዱብ ከትርፉና ላሕ ይባሃል አሎ ዝገርም እዩ,0,0,0,0,1,1
tir_train_track_a_01017,ድሓር ከአ ክትፈልጦ ዘለካ ሓንቲ ትግራይ ምስ ሰለስተ ሃገራትን ምስ ሐጪነ መጪን ገጢማ ቅልጽማ አርእያትኩም ተራእዩ ዘይፈልጥ 600,0,0,0,0,0,1
tir_train_track_a_01018,ዕስለታት ማለሊት ዘሸነፈ ሓደ ሰብ ኣባል ባይቶና። ንላእከ እንተይ ከምዝበሎዶ ቶፈልጡ ብትግራይ ለሃጃ ተዛረብ ቅኔ ኤርትራዊ ኢኻ ንሃብሮም ኣይእትወካን ሕጉስ ኢኻ,0,1,0,0,0,0
tir_train_track_a_01019,ካብ በራሕሌ ናብ ሰርዶ ተዛዊሮም ግብረ ራዕዲ ህወሓት ብዝፈፀሞ ሓዱሽ መጥቃዕቲ ዝተመዛበሉ ኤርትራዊያን ስደተኛታት ካብ መዓስ,0,1,0,0,0,0
tir_train_track_a_01020,እንዳሞትኩም  ከም ገመል ኣይትግዓሩ,0,1,0,0,0,0
tir_train_track_a_01021,"ርዋንዳ ኣብ ""ንግዲ ደቂ-ሰባት"" ትሳተፍ የላን ክብል ፕረዚደንት ፖል ካጋመ ገሊጹ",0,0,0,0,0,0
tir_train_track_a_01022,እዚ ድእ ካብ ናይ ወያነ ውዱብ እንታይ ይፈልዮ ጸልማት መጻኢ ብሓቂ,0,1,0,0,0,0
tir_train_track_a_01023,ሕብሪ ትግራዉነት ፉሉይ እዩ ትዕደልቲ እዩ ጀጋኑ ኣሕዋተና ብሳላኹም ንብዓት ኣዶ ትግራይ ተሓቢሱ ሰብ ወነ ፈደይቲ ሕነ,0,0,0,0,0,0
tir_train_track_a_01024,ኣብ ዛዕባ ጾታዊ ርክብ ገለ እንስሳታት እንታይ ንፈልጥ?,0,0,0,0,0,0
tir_train_track_a_01025,googlecrome4863 ኣታ ወዲዞም ርኩሳት ኣይትላገፅ  መስጣ ናይዞም ቆልዓ ሰበይቲ መወዳእታኻ ሕማቅ ከይከዉንእዚ ህዝቢ ዘለዎ ሓዘን ይኣክሎ ኣብ ዝዝሓለፍክሞ ጨው ኣይትነስንስሉ ናብ ቆስስሉ ሓላዮ መሲለን መንቆሮ ኣይትኩን ok,1,1,0,0,0,0
tir_train_track_a_01026,ዝገርም ስራሕ ስነ ጥበብ ትግርኛ አውን ይዓቢ ኣሎ,0,0,0,0,0,1
tir_train_track_a_01027,ኣነውን ብጣዕሚ ካብ ዝፈትዎ ባንኪ 1ኛ ባንኪ ወጋገን እዩ።,0,0,0,1,0,0
tir_train_track_a_01028,ካሊእ ፅልኢ ተሀሊዩካ ወይ ድማ ሰላም ከይመፅእ ትደሊ ተኾንካ በግልፂ ተዛረብ እቲ ኮንዶሚኒየም አለዎ ገለ ግን ዓፈ,1,0,0,0,0,0
tir_train_track_a_01029,ኣንቱም ህጅም ቁሩብ ኣይትሃፍሩን ሓሶት ናተይ ኢልኩም ሂዝኩሞ ፈርሃ አምላክ ይሃልወኩም,1,1,0,0,0,0
