id,text,anger,disgust,fear,joy,sadness,surprise
vmw_train_track_a_00429,Maama awe taraviixita iiviwe oParasiili othatuxa mulaala khikhala epanttera ya mulala,0,0,0,0,1,0
vmw_train_track_a_00430,Blatter onnimuloiha EUA  aaniphavela namathanla wa FIIFA  okhale ntoko saaphavelaawe.,1,0,0,0,0,0
vmw_train_track_a_00431,Masetooniya: mapolokeero anitthapela Oxiitta Sooluluwana n maFasiixita eyaakha ya 1945,0,0,0,1,0,0
vmw_train_track_a_00432,"Frelimo ni Renamo anvirihasa mwaathanle wa mmaporovinsiyani, nave MDM onookoha.",0,0,0,0,0,0
vmw_train_track_a_00433,Biden onikhotthiha oruuhiwa petarooya ni kaaxi a Oruusiya,0,0,0,0,0,0
vmw_train_track_a_00434,Ohikhala nroromelo ni mwaha sinooniherya oreeriheliwa Mwiwanano wa oPutapeesiti mpantte a Parasiili,0,0,0,0,0,0
vmw_train_track_a_00435,"Kiine-Pisaawu:Exipitaali yohaawa"" okarakanyuwa"" mwaha wa ekoolope ti estaato",0,0,0,0,1,0
vmw_train_track_a_00436,Guterres onvekela owananiwa voowaakuveyaxa opittikuwasa wa ekilima,0,0,0,0,0,0
vmw_train_track_a_00437,Muhooleli a mphirya olimpiku onnaavaha ethuvo anamahaawa a oVulvogrado,0,0,0,0,0,0
vmw_train_track_a_00438,Okhanyereriwa wonanara wa athiyana oomosampiikhi ennikhumiha muxankiho,1,0,0,0,0,0
vmw_train_track_a_00439,Mmusiwele paatiri parasileera onaakhaliherya ale anikhala mpikatani- ni anihaawamwaha sa waatakariwa ni woopopihiwe mwi vaavo,0,0,0,0,0,1
vmw_train_track_a_00440,Athiyana maxileenobopattuxasa ikumunitaate ninoleelo woreera amurumeelaka Raatiyu,0,0,0,1,0,0
vmw_train_track_a_00441,BAL: BBC Patriots oRuwanta,0,0,0,0,0,0
vmw_train_track_a_00442,"Variyari va ohikhala maasi ni ohisuwa.nyeya mukhalelo wa epheyo, muttetthe mexikaano ya Keretaro enihoolela mukacamikho Ani wiraneye opirivatisariwa  maasi",1,0,0,0,0,0
vmw_train_track_a_00443,Muxovo wa otaaka oniixiiliha mwaha waekwerere ya chikungunya,1,0,0,0,0,0
vmw_train_track_a_00444,"Alice Machado: "" Mondiano namalepa mmosa woosuwelaxa olepa ni owaasiveliha atthu.",0,0,0,0,0,0
vmw_train_track_a_00445,"Mário Machungo, miniixituru mosampikaanu oopacerya a khayi, okhwaale ni miyaakha 79",0,0,0,0,1,0
vmw_train_track_a_00446,El-Nino ookuruxa yooruwerya wa 25 imilyawu sa anamalimi wa Afrika Awustrali,0,0,0,0,1,0
vmw_train_track_a_00447,maativixita ni kuveerunu annivirikana mwaha wa muthinto wa siita Wankooxi,0,0,0,0,1,0
vmw_train_track_a_00448,"Eliivuru ya Xoronaliixita faranseesa onikhala muhina mwa  ""nihimo na anamawerya""",0,0,0,0,0,0
vmw_train_track_a_00449,"Evan Claver mostra ""Folk Tales- masipo aatthu"" o Luwanta",0,0,0,0,0,0
vmw_train_track_a_00450,"Joaquim Chissano: Atthu a Waafirika arisa voophova wiraana, masi ahaana omalamaliha manyaku nyaku ni wikhanyanya ni miteko sosomiha.",0,0,0,0,0,0
vmw_train_track_a_00451,Anakhotto asya avelaveliha  wa ilapo sovirikanya wa ohiitto ya elapo yo oMosampiikhi.,0,0,1,0,0,0
vmw_train_track_a_00452,Mosampiikhi: Oovukula wahaaxa alipo otthukiwa  mukhatteya,0,0,0,1,0,0
vmw_train_track_a_00453,Francisco onimaaliha ovekela exootte ni onakiha okhotto yowanana makwankwa,0,0,0,1,0,0
vmw_train_track_a_00454,Namphira ole onaakhula nsina na Ibrahimovic olola mwaha wa ekoolu yeele mwaakha.,0,0,0,1,0,0
vmw_train_track_a_00455,Rosa Roque: Anamapaka oowiiwanana pooti ohela osulu wa elapo woolimalela ya wankoola,0,0,0,1,0,0
vmw_train_track_a_00456,Onuunuwa moonelo wa Ukaanta vooluluwana ni mwaha sa ettekuxa yoopattuxa ni axiitthu aniiva,0,0,1,0,0,0
vmw_train_track_a_00457,"Mmosampiikhi, atthu anceene aniphwanyaneya ahikhumaka mpaani mwaha wa omwiinanela koronaviiru.",0,0,1,0,0,0
vmw_train_track_a_00458,"Tayilaatiya, Kampooca: Ohiwanana  mmukanooni oniilipiheriwa",0,0,1,0,0,0
vmw_train_track_a_00459,Olumwenku Akhiyaarabu: Weyiiwo ale khamosa khamosa ari ni mulala mwaha wa Osama Bin Laden,0,0,0,0,1,0
vmw_train_track_a_00460,"Soohinya sa spyware Pegasus indica sinithoonyerya wii Iitiya onathurumela alipo a ihapaari, mativiixita ni mapuliitiku",0,0,1,0,0,0
vmw_train_track_a_00461,"Muuro toottapitta, mukhulaaku etthu yowaawa': nttophe noowunkha nittheliwe ni alipo anithiipa maluuku oParasiili noophiya mupahari mwa Atalaatiku.",0,0,0,0,0,0
vmw_train_track_a_00462,Muhooleli wa institutu nasionaale  ya sekuransa mmuttetheni ootthukeliya mwaha woowotororya muhakhu,0,0,0,0,0,0
vmw_train_track_a_00463,"Ni mukhaliheryo a maafa, Azagaia oopwanya mureerelo wiira wooperariwe viipale awe Wiitiya",0,0,0,1,0,0
vmw_train_track_a_00464,Muvirikano wa ipheyo onitthikela wooniherya ekhoove awe soophova eyaakha ya 2015,0,0,0,0,0,0
vmw_train_track_a_00465,"Anamalatha Owiraana ni a Ilapo piiliw othoonyerya  "" Iwarakha sa Niphento n'a Parasiili owoniheriwa Iraakhi"" oniphavela otuupha muhupi sa murettele",0,0,0,1,0,0
vmw_train_track_a_00466,Guterres onivekela irefooruma wa ONU ni wiira amahoolela yiiwe okhuwela w'apoovu,0,0,0,1,0,0
vmw_train_track_a_00467,Anammuttettheni anniixinla ni ohikhaliwa omuro wa Oxaneyiru,1,0,0,0,0,0
vmw_train_track_a_00468,Exipaanya enimalela okhalana epiixita yoopacerya yoorukurereya moolumwenkuni enimorela ntteeke,0,0,0,0,0,1
vmw_train_track_a_00469,"Muupuwele Oluwanta, mwa soopaka saya ni mooneya",0,0,0,0,0,0
vmw_train_track_a_00470,"Nnyooho, masi Phelps ni kupaano oottwawa",0,0,0,0,0,0
vmw_train_track_a_00471,FUNAI onnilaleerya moonenelo wa nihimo nipheya mukano wa Aakere,0,0,0,0,0,1
vmw_train_track_a_00472,Iitiya oniwateeriha Tiikhi tooki ni ikinaku 58 siiri ikaruuma variyari va wuunuwa moonilo anti- Xiina ni ohiiwanana mmukanooni,0,0,1,0,0,0
vmw_train_track_a_00473,Araatiyo komunitaariya Omosampiiki aniwanana othelaniwa vahittokotthiwe,0,0,0,1,0,0
vmw_train_track_a_00474,"Tripunali piritaniku othikela mulattu ""sookopha soottukuttheriwa""",0,0,0,1,0,0
vmw_train_track_a_00475,Nkhulupale wa paritiitu Renamo onnilavula namararu yeela enirwa.,0,0,0,0,0,0
vmw_train_track_a_00476,Owaali sootthikela oKhosoovo Noomala kuveeruno akhanyereriha ihukhumu soluluwana ni Elapo ya Ruusiya,0,0,1,0,0,0
vmw_train_track_a_00477,Ehaamu  ehakamela miteko sa turiiximu omosampikhi,0,0,0,0,0,0
vmw_train_track_a_00478,Ohooneneliwa pika-paawu orikarika mukano wa EUA,0,0,0,0,0,1
vmw_train_track_a_00479,"Variyari va epuula ni ephovoovo, Peeru onilipiherya ntoko #UnaSolaFuerza",0,0,0,0,1,0
vmw_train_track_a_00480,Mosampiikhi: porokuratoore-xeraali khontthunana ni mwaattelo wa eseelu ya mapuliisiya,0,0,0,0,0,0
vmw_train_track_a_00481,Ereetta yothoowa  yomwarela mmittetthe  Piriisipe,0,0,0,0,1,0
vmw_train_track_a_00482,Khaapu Veeriti ooxinttiwa ni Kaana.,0,0,0,0,0,0
vmw_train_track_a_00483,Empaxatoore a elapo ya Wisarayeele Oren Rozenblat onooniherya ohisiveliwa  wawe ni onyoonyiwa ni Kuveeruni a Wankoola.,0,0,0,0,0,0
vmw_train_track_a_00484,Mmiravo a waAnkoola onrowa oParasiili onrowa waathukunya atthu axuttihaka mwaha waAfirika,0,0,0,0,0,0
vmw_train_track_a_00485,INE oovirikaniha mwaalakanyo wa atthu oorepeliwa owooniheriwa muttetthe yooKaasa,1,0,0,0,0,0
vmw_train_track_a_00486,Netizen Report: Empereesa ya itekonolooxiya Nooroti -amerikaana sinihimya otthuli ivolowelo munikhuruni etokweene ya akunya mwaha wookupali “papaaka”,1,0,0,0,0,0
vmw_train_track_a_00487,Muthiyana mmosa anaakhula nsina na Tatiana Lima ohiya wiira mpantta ORiiyu - 2016.,0,0,0,0,1,0
vmw_train_track_a_00488,"trending: shack, Toyin Salau, Tupac Shakur",0,0,0,0,0,0
vmw_train_track_a_00489,Manimatoore awaafirika ahoopola mattaava aya ephattu ni ilatarato sinamutheyiiha,0,0,0,1,0,0
vmw_train_track_a_00490,Ilooca saamamosampikaano sootupheliwa elapo ya osuuli ya w'Afirika,0,0,0,0,0,0
vmw_train_track_a_00491,"Ekoolo ya oMeexiku ennitannya ""etetere woopakiwa"" mulaponi",0,0,0,0,0,0
vmw_train_track_a_00492,Mamosampikaano khanirowa Okhalana tho oweereya woopwanya okumi onikhottiwa mwaha iwareelo saya,0,0,0,0,1,0
vmw_train_track_a_00493,Etthaya eroohunyuwela ephiyelela ewiivaka anamathipa athanu na tthaaru epooma ya Maniika.,0,0,0,0,1,0
vmw_train_track_a_00494,Mawuritaaniya: Ohoolo wa Opotthiwa Waninaano,1,0,0,0,0,0
vmw_train_track_a_00495,Iraa: Mapolokeero onanarasiwa ni yoovaha ya Ruusiya,0,0,0,0,0,0
vmw_train_track_a_00496,Mwanawe Pele ootthukeliwa miyaakha 33 sri mukhatteya,0,0,0,0,0,0
vmw_train_track_a_00497,Aafirika onihoolela mikacamiho sa waavaha ikuru axithiyana,0,0,0,0,0,0
vmw_train_track_a_00498,Ateeptu ovonnye enika elapo ya Espanya ori mmilatthuni.,0,1,0,0,0,0
vmw_train_track_a_00499,ONU anitumererya imiilyawu 254 sa mukhaliho othunku oniireliwa muttetthe Omosampiikhi,0,0,0,1,0,0
vmw_train_track_a_00500,Wa'Angoola: Lini athiyana anrowa ottittimihiya vooliikana?,1,0,0,0,0,0
vmw_train_track_a_00501,Mosampiikhi: Mwaha wa exeeni amakhulupale ahunahinirumeela aya ixipitaali sahu?,1,0,0,0,0,0
vmw_train_track_a_00502,Stewart Sukuma onnaakiha interkanpiyu yuulupale ya mukhalelo eriyari ya Maputu ni Luwanta.,0,0,0,0,0,0
vmw_train_track_a_00503,Anamuteko mamosampikaano Waafirika ya Okuusini anoopiha okhuma muteko,0,0,1,0,1,0
vmw_train_track_a_00504,Itixipaaxu sa mukaraniyaano 1: anittwawa oKiyeve ni amuusi ni inaama soottittimiheya,0,0,0,0,0,0
vmw_train_track_a_00505,"Mosampiiki ""ooxipheeleliwa"" ni muritti woolemela wa yookopha y'atthu ootheene",0,0,0,0,1,0
vmw_train_track_a_00506,"Maativiixita Mankolaanu anitthukelasa owaleeliwa ni wiitaphula waya, mpakha o ekathi onirowa olokeela  yoolemeleela?",1,0,0,0,1,0
vmw_train_track_a_00507,Itorooni wAameerika sootuphela oLemen nihiku noottikhiwa Muhooleli,0,0,0,0,1,0
vmw_train_track_a_00508,Netizen Report: Anamahooyasa onimuthalakaserya spyware mutelefoonini  muhina mwa ilapo 60,0,0,0,0,0,0
vmw_train_track_a_00509,"Tayiwaani: Elaapo yootepa othapa ya wAasiya Oriyentaali, ntoko vanithoonya Erelatooriyu yaMuntiyaale ya Ethaapa ya eyaakha 2022",0,0,0,1,0,0
vmw_train_track_a_00510,Miniixituru oopacerya oPorutukaale onixekurya Mosampiiki,0,0,0,0,0,0
vmw_train_track_a_00511,"Ohookhwa João de Sousa, mmosa wanamonaxixeya wa namalaleerya ihapari mMosampiki.",0,0,0,0,1,0
vmw_train_track_a_00512,"""O Brasil está tendo alguns problemas, não há dúvida sobre isso""",0,0,0,0,1,0
vmw_train_track_a_00513,Othowa muhakhu Weewuropeeya– maamala yoomaliyerya ekeekhayi ti mulaattu,0,0,0,0,0,0
vmw_train_track_a_00514,Namalamula ni Renamo aathipelela owalameliha ovaanelela myaha siluluwanne ni epoliitika,1,0,0,0,0,0
vmw_train_track_a_00515,Coluna opaxari ekumi awe yootepa.,0,0,0,0,1,0
vmw_train_track_a_00516,Tani ori muhooleli  a kokhola sowaatta siiwiive  atthu 16 mMosampiikhi?,1,0,0,0,0,0
vmw_train_track_a_00517,Nikhuuru na  amopopihi maparasileero anilapha ohivonyola ni otharihela mitumereryoo  Exitaato yamwisilamu,0,0,0,0,0,0
vmw_train_track_a_00518,Mosampiikhi onaattikiha 17 matíopi,0,0,0,0,0,0
vmw_train_track_a_00519,Muhooleli wa sintikaatu oveehiwe oPenkela mwaha wa waakiha muupuwelo wa kuverunu.,0,0,0,0,0,0
vmw_train_track_a_00520,Mphira: Yooyariwa etthineeri ya mphira ni musivelo wa oKwine Pisawu,0,0,0,1,0,0
vmw_train_track_a_00521,Atoroopa a Wamphula anithoonyiwa okhala alipo omana ni orupiha,0,1,0,0,0,0
vmw_train_track_a_00522,Repper ankolaano MCK owaterihiwa okhuma Wankoola,1,0,0,0,0,0
vmw_train_track_a_00523,'Luwanta Leaks': Muthiyana othaacirixa a WaAfirika oniromoleeliwa mwaha wa makwankwa ni othawali woohisuwanyeya,0,0,0,0,0,0
vmw_train_track_a_00524,"UA, Sinkapuura: Nttittimiho' noothuma amwaseeta orumeelaka ikartaawu sa okoopha",0,0,0,0,0,0
vmw_train_track_a_00525,Ettekuuxa yoowiiva ikonto 600 sa atthu iyaakha soteene,0,0,0,0,1,0
vmw_train_track_a_00526,Terentink: Waatakariwa wa Itoore Xeemeya evinre miyaakha 19,0,0,0,0,0,0
vmw_train_track_a_00527,"P.W. ohooniherya muteko wa EP ""Welcome""",0,0,0,0,0,0
vmw_train_track_a_00528,Ankoola onilavula paahi: Epilyeti ya osuweliwa Tony Caldes,0,0,0,0,0,0
vmw_train_track_a_00529,"Chris Christie,  ole oniphavela othaliwa mpantte wa ma repupilikaano",0,0,0,0,0,0
vmw_train_track_a_00530,Iretta mwiikhoo athiyana wokiserani sinlavuliwa muri atthu anceene.,0,0,0,1,0,0
vmw_train_track_a_00531,Iraa: Empayixaata Piritaanika oTeeraa wootupheliwa,0,0,0,0,1,0
vmw_train_track_a_00532,Mosampiikhi: atthu athanu ni araru alokohiwe omwiiva namaweha a namathanle.,0,0,0,0,0,0
vmw_train_track_a_00533,Athiyana a ekontineeti thaanu anaakhela etthuvo Mwaha woovaha mukhaliheryo aya mpantte wa amphiira,0,0,0,1,0,0
vmw_train_track_a_00534,Parasiili: Telekaato apiliisa amwatakari mulopwana ari ni erikiixo,1,0,0,0,0,0
vmw_train_track_a_00535,Wiiyiwa onnitepa ni onnithaniha muttetthe Wafirika oSitentaale,0,0,1,0,0,0
vmw_train_track_a_00536,Mantiyaano ni mapakixitaneexi anilipelelaka wiira ilaapo saya ikhaale sowataana,0,0,0,1,0,0
vmw_train_track_a_00537,ONG ooKine onnaaphuka atthu eelapo anilima irutthu soolatta soovirikana,0,1,0,0,0,0
vmw_train_track_a_00538,Eviiyawu emosa vamosa ni atthu axineene elapo athanu ni ayili  aarimeela mutakwani  waAmasoonika ni oParasiili khonilavuliwa mwaha ola,0,0,0,0,1,0
vmw_train_track_a_00539,Onyakulihana oMosampiikhi: Soxooku onkhootta oliva itthuvelo sa imphira,0,0,0,0,0,0
vmw_train_track_a_00540,"Mihakho sa ifaawuna sa mMosampiikhi sinihala okumihiwa, anilavula maanaliisita.",0,0,0,0,0,0
vmw_train_track_a_00541,Kiine Ekwatoriyaale: Muleepi ni ekhereve ya Etala,1,0,0,0,0,0
vmw_train_track_a_00542,"KOVIT-19: Vamosa ni alipo enaawereya , kuveerunu a wankoola othaamiha ni mukhalelo emukakuve ekaruma ya epalatafooroma ya pataroya muttetthe wa Sooyo .",0,0,0,0,0,0
vmw_train_track_a_00543,Anamathokoca ahoonanela mananna makinaku a mweettelo wa inowa sipheya,0,0,0,0,0,1
vmw_train_track_a_00544,Imperensa: Maxoronaliisita a mmosampiikhi aniphavela wiira okhalana  tho ifonte.,0,0,0,0,0,0
vmw_train_track_a_00545,Filipe Nyusi onaavekela maministuru a mwaakiheryo wa aatthu ootheene.,0,0,0,0,0,0
vmw_train_track_a_00546,Intiiya ni Ilapo sa wafiriika sinihaayasa miyatano isya.,0,0,0,0,0,0
vmw_train_track_a_00547,"Anamawerya a Waameerika anaanyiherya  ""okumihiwa"" wa othanleliwa oRuusa wa mphirya eelapo yootheene",0,0,0,0,0,0
vmw_train_track_a_00548,"COVITE-19: Anthony Faucy onihimya wiira nummaru n'atthu akhwiiye noovikana ninne nihimiwe ni ""wootepaxa nlelo khevirenre"".",0,0,1,0,0,0
vmw_train_track_a_00549,Mwaha xeene  vahinirupaaya epuula oKiine Pisaawu ntoko vakhalayini,0,0,0,0,0,0
vmw_train_track_a_00550,Nikhuru na macamayikaano na mphira Reggae Girlz ' ninatakari ni ikuru' wii nipake ethale,0,0,0,1,0,0
vmw_train_track_a_00551,Global Voices Podcast:  Ikaaruma isya Sinilipiherya!,0,0,0,0,0,0
vmw_train_track_a_00552,Dhlakama oniira wiira onirowa weettiherya iporovinsiya mweeri wa Maarusu,0,0,1,0,0,0
vmw_train_track_a_00553,"Kaapu Verte muttetthe woreera wa nttaava na ekunya Waafirika ovariwa miteko sa nakoso, aahimya amahoolela epanku ekhulupale ya molumwenkuni.",0,0,0,0,0,1
vmw_train_track_a_00554,"Efiilimi Xineexi"" Mukuthaano wa Laaku Changjin” ennipittikuxa ethale yohiirya ya Ekhotto ya oKoreeya ni oxintta woowaarya",0,0,0,1,0,0
vmw_train_track_a_00555,"Maluuxu Veeriti wAafirika: muthokiho muulupale, ikaweliwo ôta wa reeti wala manamuuna mmosa?",0,0,0,0,0,0
vmw_train_track_a_00556,FAP wa makamarawu otumiha ni esisapo yowalamila oxiittiwa ahoolo wa Petooro wa Oluwaanta,0,0,0,0,0,0
vmw_train_track_a_00557,"Owiiwa okopihiwa musurukhu Kuveerunu wa elapo ya Mosampiiki onnitepiha ohaawa elapo yeela, nilavulaka nikhuru na teeni yeela epakiwe elapo ya Mosampiiki.",0,0,0,0,1,0
vmw_train_track_a_00558,Ofalyari wa muupuwelo wa ororomeleya eri wa opacerani wa yootakhala ya Uixe.,0,0,0,0,1,0
vmw_train_track_a_00559,Mário Coluna oviira etuniya,0,0,0,0,1,0
vmw_train_track_a_00560,"Anamwane mamosampikhaano ""annikhuwela""  mwaha waa okhapelela",0,0,0,0,1,0
vmw_train_track_a_00561,Anamaatthara aamuttyawa MDM,0,0,0,0,0,0
vmw_train_track_a_00562,Mosampiikhi: Mutaaseke Irina oophiya mpantta wa osuuli saapatu,0,0,0,0,0,0
vmw_train_track_a_00563,Isarayeeli nihiku na othanla otepa ophuunyeya,0,0,0,0,0,0
vmw_train_track_a_00564,Saawu Toome ni Piriisipe: omalamalihiwa etaakwa Onoopopiha mireerelo Soovirikanasa,0,0,1,0,0,0
vmw_train_track_a_00565,Mosampiikhi aniphuka ninyooho nootepa na mireerelo muhina mwa ehantisi aya,0,0,0,0,0,0
vmw_train_track_a_00566,Nyusi othuniheryaka ololasa wa mwaathanle waamakhulupale,0,0,0,0,0,0
vmw_train_track_a_00567,"Parasiili : Wixilihiwa wa neeraru contrat isisapo sa epasagi yaari yoohiwali, masi epaale ni ipoopa muhina mwa meetoro",1,0,0,0,0,0
vmw_train_track_a_00568,Nahapaari ni anamalaleerya mamosampikaano tanooneyaxa mowoopopihiwani mwaakha wa mwathanle,0,0,1,0,0,0
vmw_train_track_a_00569,Ohookwa Shimon Peres,0,0,0,0,1,0
vmw_train_track_a_00570,Faransa: atthoro anilyihiwa nakhuwo oopittikuxiwa onninnuuherya wiipiwa vanceene,0,0,0,0,1,0
vmw_train_track_a_00571,Afiriika ti Suuli: Woopola wa Afrikaans,0,0,0,1,0,0
vmw_train_track_a_00572,"FMI ""onimuttottopela"" Mosampiki",0,0,0,1,0,0
vmw_train_track_a_00573,Messi nammana imphira onliviwa musurukhu wa okisera mwaakha wa 2020 ni onkela ekulupi ya piliyonaariyu.,0,0,0,0,0,0
vmw_train_track_a_00574,CAN 2021: ale yakhweyihiriwe axinttale ni mammaru ooyevaxa.,0,0,0,0,0,0
vmw_train_track_a_00575,Atthu eriyari ya maparasileyiro ari oohittuna Olimpiiyata.,0,0,0,0,1,0
vmw_train_track_a_00576,"Nakhuru sa ophaka isukhiri anninuw, nave nto mixankiho sinceene, anahima anamoona.",0,0,0,1,0,0
vmw_train_track_a_00577,Musareyo wa maasi woowiiva atthu athanu ni oopwanyula impa sa atthu oophiyeryaka 1800 elapo ya Oteete.,0,0,0,0,1,0
vmw_train_track_a_00578,Atthu ariina HIV akhalana oweerya voviriha né Ekuumi yexikhaani ni mukhaleelo owilipiiha wakhuleele milooko.,0,0,0,1,0,0
vmw_train_track_a_00579,Amwathaale owekwatoroyaana anoonihereya ni ohaaxiwa muhina mwa websiitini ni ottharuxiwa ikootha sa Tuwiiteri,0,0,0,0,0,0
vmw_train_track_a_00580,Eliivuru ya Ungulani Ba Ka Khosa eliivuru emphwanyaneya eriyari ya 100 sootepa sa iromanse sa waAfrika ya eseekulu. xx,0,0,0,1,0,0
vmw_train_track_a_00581,Amwaavano athukumana oXiina wiira aruuhele exikhaani mwa sooyeleela sa mireerelo sovirikanaasa ni aninuuherya wuraana vamoosa ni ephaattu.,0,0,0,1,0,0
vmw_train_track_a_00582,COVITE-19: Mosampiikhi ni Kaapu Veerete ohaarepela atthu asyaa a eretta,0,0,1,0,0,0
vmw_train_track_a_00583,Mapatarawu ni Kuveerunu aniphavelasa inamuna soomaliha ekirise ya muhakhu oMosampiiki,0,0,0,0,0,0
vmw_train_track_a_00584,Osiikhini ni opuherya opuheriwa wa anamwane wAnkoola onooniheriwa muliivuruni,0,0,0,0,0,0
vmw_train_track_a_00585,"Koronaviiru: Atthu owaatta yaphwanye eretta yeela elapo ya Ameerika ari anooriipe, maxipaaniku, masiyaatiku ni aneene elapo yeela ya Ameerika.",0,0,0,0,1,0
vmw_train_track_a_00586,Atthu Omosampiikhi Wafiriika ti suuli vohiroromelo mwaha wa ewarakha ya erumeeliwa ekwaha ya okhopeela,0,0,0,0,1,0
vmw_train_track_a_00587,Akohikohi wa Senturu interenasiyonale ya kharaka yotthuveliwa ya eyolya ya Olumwenku,0,0,0,1,0,0
vmw_train_track_a_00588,"Amilcar, mpantta mukina wa Cabral mukaratanani a Leena",0,0,0,0,0,0
vmw_train_track_a_00589,Nikuurutha na etooropa nikhuuru anilipiherya vowataana Mosampiikhi- Exitaato Uniitu,0,0,0,0,0,0
vmw_train_track_a_00590,FIFA ni UEFA ahiiha elapo yo Ruusiya okhalela mixinttaano sa mphira.,0,0,0,0,0,0
vmw_train_track_a_00591,Niira na oLusufooniya wa Noova Iyoorikhi: oporutunitaati mmosa wa muvaanelo.,0,0,0,0,0,0
vmw_train_track_a_00592,Xeefe a Fifa opwavela puro mayiili awafiriika muhina mwa niira na Mutiyaale na mphiira.,0,0,0,0,0,0
vmw_train_track_a_00593,Mosampiikhi onnireeriha  ePareke Nasiyonaale ya Arikipelaku ya Pasaruutu,0,0,0,1,0,0
vmw_train_track_a_00594,Xooku Olimpiku wa Eyiita : Namphira wa elapo ya Kanata onnaanyeriwa wiiya mukukutta wa elapo ya Koreeya tu Suuli.,0,0,0,0,0,1
vmw_train_track_a_00595,Matunisiyaano ahiiwa ni eparkha aya muhina mwa ekhotto yowanana KOVIIT-19,0,0,0,0,1,0
vmw_train_track_a_00596,Mosampiikhi : Maniika onitthikela okhala Ephiiro ya alipo otupha mikaano ohitthariha ikettelo,0,0,0,0,0,0
vmw_train_track_a_00597,Vicente Ramya okhwiye mpuwa mwa mukukutta awe olelo oMaputo,0,0,0,0,1,0
vmw_train_track_a_00598,Mosampiiki Exitaatu emosa ya Waafirika erina ehaali yoowalamela mwaha woowaattanela sookophiwa s'atthu otheene.,0,0,0,0,1,0
vmw_train_track_a_00599,Namattikha imphira akhlayi oofransa Lilian thuram  onrowa woonihera eliivuru oLuwanta.,0,0,0,0,0,0
vmw_train_track_a_00600,Antony Blinken vamoosa ni Sergei Lavrov athukumanaasa Oxeneepera enamathanu mwaha wa elaapo ya Ukaraaniya yaari osuulu wameesa  nthukumaano.,0,0,0,0,0,0
vmw_train_track_a_00601,Eduardo dos Santos vasyaa Opareceloona,0,0,0,0,0,0
vmw_train_track_a_00602,Nikhuru  na  Ihakhi sa apinaatamu  a  ONU  anoorowa  ovanyihana  voluluwana  ni  myaaha  sa ovonya wooluluwana  ni  Koviit-19,0,0,0,0,0,0
vmw_train_track_a_00603,ONG owoopolaa anamwane asithiyana ovikana 100  mothelanani mowaakuveya oManica,0,0,0,1,0,0
vmw_train_track_a_00604,ONU onihimya wiira aphiyaka emilyawu emosa ya  atthu anihoolela ohikhalana eyoolya oMosampiikhi,0,0,0,0,1,0
vmw_train_track_a_00605,Miriira sa wakheliwa Mmaterinitaate,0,0,0,0,0,0
vmw_train_track_a_00606,Trending: WizKid olaleerya Made in Lagos,0,0,0,0,0,0
vmw_train_track_a_00607,Niceeri: atthu okwa 12 ni 12 mortos e 27.000 othamihiwa mapuuro aya mwaha wootothowa,0,0,0,0,1,0
vmw_train_track_a_00608,Mosampiikhi: Soowerya sa Kuverenatoora Muusya siniheliwa okhala mwaha wa mawxiiximu,0,0,0,0,0,0
vmw_train_track_a_00609,Ankoola onirowa warooha nnakhalaka  ikooto piili sa atooropa muttetthe wa Erepuupilika Senturu -Afirikaana,0,0,0,0,0,0
vmw_train_track_a_00610,"Best Blogs Parasiili: Anamalola oothaaliwa ni ejuuri, anamunceene ni hackers",0,0,0,0,0,0
vmw_train_track_a_00611,Woova ni ohikupali: okhala wa maceyoriciyaano oKaali,0,0,1,0,0,0
vmw_train_track_a_00612,"Ankoola:""Ihalayala sa Ekhotto Soothatuwa ipirikeeto",0,0,0,0,0,0
vmw_train_track_a_00613,Netizen Report: Wuluula onitthikela nnaamwi epwepwetthe etepaka okhala yootepa oVenesuweela,0,0,0,0,0,0
vmw_train_track_a_00614,Mukhalelo wa  muhakhu wookophiya enoohoona empereesa yuulupale ya itorokarponeetu,0,0,0,0,1,0
vmw_train_track_a_00615,"Anamatholathola ahoonenela ehimye yookhalana miyaakha ikonto 1,5 yaari ya muluku kereku okisirwa ya Opulukaariya",0,0,0,0,0,1
vmw_train_track_a_00616,"Alaleerya araaru anti- koopa animuthonya Parasiili mwiriira otharatharana mulattu wa itumereryo ni, vohiithu, anihaayasa woottwawela ekosnsulaatu ya wuUrukwaayi",0,0,1,0,0,0
vmw_train_track_a_00617,Athiyana anitthikela ohooneliwa vatthu munkoni woopwanya muteko.,0,0,0,0,1,0
vmw_train_track_a_00618,Guebuza onookela okhalela onikelaawe osikhiwa Kok Nam,0,0,0,0,0,0
vmw_train_track_a_00619,"Alipo anaakiherya Soohala siivili anitthapela wakhuleliwa wa "" Nlamulo na Interineeti""",0,0,0,1,0,0
vmw_train_track_a_00620,"""Omaaleleya wa ekhotto"" eliivuru ehinliyali ethale.",0,0,0,0,0,0
vmw_train_track_a_00621,Peera: atthu emiya sene anhova woopola paleyiya emosa epharaya ya Pikexi,0,0,0,0,0,0
vmw_train_track_a_00622,Kapora Pasa woohoova muwaneliho,0,0,0,0,0,0
vmw_train_track_a_00623,Trentink: Porotilanti; Juventu; Man Unayiteti,0,0,0,0,0,0
vmw_train_track_a_00624,Mosampiikhi: Wa anamwane vakhaani aniyariwa ni SIDA anikhwa ahinatthi opaka miyaakha miili.,0,0,0,0,1,0
vmw_train_track_a_00625,Ukaata: eporoceetu ya nlamuulo anti- keeyi yootthika,0,1,0,0,0,0
vmw_train_track_a_00626,"Kuveerunu ohaana okoha kohaka wowaakuveya soottheka sa ekhotto sa oKaapu-Telekaatu, oleveleliwa soottheka wa ilapo sa okhopela.",0,0,0,0,0,0
vmw_train_track_a_00627,Noruweeka onnivaha miruku elapo ya Omasampiikhi wiira ekhalane  musurukhu woosukiwa  ni olipiherya elapo.,0,0,0,0,0,0
vmw_train_track_a_00628,Mugabe ohuuluula ophatthanana ni Aafirika tu Suuli,0,0,0,0,0,0
vmw_train_track_a_00629,Nivekeelo na senatoore noohihimuxa Miruuku soovukula nlamulo na okurumula ehamela,0,0,0,0,0,0
vmw_train_track_a_00630,"Ni ohikhala murettele ni wiilyiha, Asiiya Senteraale onimwireherya wiirelaka mwaha sa muteko okhanyereriwa ni opotthana wa mukhoveni",0,1,0,0,0,0
vmw_train_track_a_00631,maAnkoolano amphavela otatuxa ekontentoore wa miteko soopakiwa,0,0,0,1,0,0
vmw_train_track_a_00632,Mikaano sa Ewuuru 2012,0,0,0,0,0,0
vmw_train_track_a_00633,Anamataphuliwa Internasiyonali nnaalevelela atthu ninvekela okhupaareliwa Nyusi wa namuwehaweha moothiyana ootuthuwa.,0,0,1,0,0,0
vmw_train_track_a_00634,Mukhalelo wa ekolooniya emoosa saalipo a Marietta oMiyamaare,0,0,0,0,0,0
vmw_train_track_a_00635,Barack Obama: Olamula elapo ni inamuna soohireerela siirinhe ehasara ya muhakhu Ozimpaapwe.,0,0,0,0,1,0
vmw_train_track_a_00636,Messi ti mphiira a eweero  wa ekwaaha yanethaneeli,0,0,0,1,0,0
vmw_train_track_a_00637,"Masu anipacerya wakiherya exariya ya ""esuruma"" Omosampiikhi",0,0,0,0,1,0
vmw_train_track_a_00638,"""Renamo onivekela omala mituphelo sa Kuveerunu""",0,0,0,1,0,0
vmw_train_track_a_00639,"Dos Santos khoniwere'iwa, mukumi, onhimya kuveerunu awAngoola",0,0,0,1,0,0
vmw_train_track_a_00640,Kuveernu ni ipartiitu kaapu-vertiyaanu sihoonela epaphelo ya Dhlakama wa wuunuwiha Mosampiikhi,0,0,0,0,0,1
vmw_train_track_a_00641,Enoota yooreerela wa koverno awankola woowikasopa koronavirus,0,0,0,1,0,0
vmw_train_track_a_00642,Anamwaane anli wa araaru anikwasa wa khuta nihiku Oxiripitaali ya Munisiipiyu wa Openkeela.,0,0,0,0,1,0
vmw_train_track_a_00643,Polooniya: Sowaakhula sopaceriha mwa okwa wa Muhoolel Kaczy?ski,0,0,0,0,1,0
vmw_train_track_a_00644,Muteko wa anamapaka itthu soopwatthiwa ooParasiili annikhala osulu oMaputu,0,0,0,1,0,0
vmw_train_track_a_00645,Olavula nno onirowihiwa ohoolo ni miniixituru wa Finansa wa elapo ya Mosampiiki onnirowa olakiherya  namuna iya sa ''teeni yeela epakiwe''.,0,0,0,0,0,0
vmw_train_track_a_00646,"Ankoola: Annihala maasi, maluuxu, novileela?Pusiina paahi!",1,0,0,0,0,0
vmw_train_track_a_00647,"""Status Quo"", soxaakiha sa mosampiikhi  muteelani mwa Nelsa Guambe",0,0,0,0,0,0
vmw_train_track_a_00648,Esiisi emosa eniwela mmwirini: Mwene ohisilimu oniinlipiherya muwakmeliwani napiliisa oRiiyu ti Caneero,0,0,0,0,0,0
vmw_train_track_a_00649,Wamphula: MISA onyohola woopopihiwaa alipa oohimya ihapari ya Raatiyo Enkonturu.,1,0,0,0,0,0
vmw_train_track_a_00650,Mulipo Ohiitto - Waafirika  onilaleerya wookotthiwa  wa mulipa omosampiikhi Emmanuel Sithole,0,0,0,0,0,0
