id,text,anger,disgust,fear,joy,sadness,surprise
vmw_train_track_a_00867,Mosampiikhi: ONU onpheela ikonto 30 ya etoolare woowira  yakhaliherye atthu ale oohaawa wa epheyo ele evinre.,0,0,0,0,1,0
vmw_train_track_a_00868,Donald Trump onorowa okhwaranya ewarakha enikhottiya othamela EUA.,0,0,0,0,1,0
vmw_train_track_a_00869,"“ Orupihiwa wiirelaka oxinttana"" oruuhela okwa wa axiiwali anli oParasili",0,0,0,0,1,0
vmw_train_track_a_00870,Michelle Obama wophwanyaneya wawe w'Afirika okumaana Nelson Mandela.,0,0,0,0,0,0
vmw_train_track_a_00871,Kiine-Pisawu: Otuturyeya wapinaatamu ni onittharihela variyari va manyakunyaku,0,0,0,0,0,0
vmw_train_track_a_00872,Eviitiyu enooniherya ovonyliwa ihakhi sapinaatamu eyaakha ya 2013,0,0,0,0,0,0
vmw_train_track_a_00873,"Hothe ni Muhooleli onithokela mukhaleelo wa epiicemeenti, ‘Emuusi ya Omweene’ oniphavela opaka emoosa ‘Game of Thrones’  wi vakhume etthu",0,0,0,0,0,0
vmw_train_track_a_00874,Benjamim Netanyuha ohootheriwa opaka ekiriki ya ekhotto,0,1,0,0,0,0
vmw_train_track_a_00875,Mahiku  ari  19  mweeri  wa  Netha  ni  miraaru:  Olumwenku onattittimiha ikonto  sa  anamuteko  oothunku,0,0,0,1,0,0
vmw_train_track_a_00876,Nikhuru na UEFA ninrowa omukumiha Ruusiya ni Nkalateera mpoolaniwa Ewuro 2016.,0,0,0,0,0,0
vmw_train_track_a_00877,"Joaquim Chissano onilavula muthowelo wa ewahala temokaraatika Mmosampiikhi, maanaliixita anavaanyiha",0,0,0,0,0,0
vmw_train_track_a_00878,Ankoola: Othapelakamweeri wa athiyana awankoola ni ipowesiiya,0,0,0,1,0,0
vmw_train_track_a_00879,Mosampiikhi ohoona omora wa Iintisi Iparahimu,0,0,0,0,0,0
vmw_train_track_a_00880,Mpantte Mulweene oMeexiku onihawa ni miriira sa iteetere piili variyari va mweeri mmosa,0,0,0,0,1,0
vmw_train_track_a_00881,KOVIT-19: OMS oowerya wiiwanana wa miili imilyawu ithanu ni iraru sa toolare wa  vasina ya eretta,0,0,0,1,0,0
vmw_train_track_a_00882,Etala ehaakuxereriha anamwane imiya imiya sene para opetiyatiriya ya Oxipiritaale ya Openkeela,0,0,0,0,1,0
vmw_train_track_a_00883,Alipo oohiiyara ookhanyereriwa oPeru annirowa waavya exariya,1,0,0,0,0,0
vmw_train_track_a_00884,Yosoomwa sinikasoopa miyopoopiiho wyowaatte ihamela okathi wa omwaruusi Omosampiikhi.,0,0,0,0,1,0
vmw_train_track_a_00885,Josina Machel  variyari waari athiyana 100 otepeexa ottittimiheya a  eyaakha ya 2020,0,0,0,1,0,0
vmw_train_track_a_00886,Oohimutthula sekeretaari oomalela a ONU Amina Mohammed ni akhulupale ooliwiiku antihukumana sookhala vamosa ni Mosampiikhi.,0,0,0,0,0,0
vmw_train_track_a_00887,"Mosampikhi: Albano Carige, muhooleli musya oPooma wo Peera, onlemeliheriwa oyense wa ekhulupale meelo",0,0,0,1,0,0
vmw_train_track_a_00888,Eliivuru ya Emanuel Kunzika eniromoliwa mukhaleelo wa ekhotto yowoopola Elapo ya Ankoola,0,0,0,0,0,0
vmw_train_track_a_00889,COVID-19: Pooti okhwa namwane imiya thanu ni mosa nihiku nimosa sa miyeeri thanu ni mosa sinirwa,0,0,1,0,1,0
vmw_train_track_a_00890,Mosampiiki enniphwanyaneya ekhalanaka eteeni yuulupale soovikana iteeni sikinaaku sa Afirika Supisahariyaana.,0,0,0,0,0,0
vmw_train_track_a_00891,Itaari soolikanasa soluluwanyiwa ikereeca ni oteeli sotanya yowoopiha o Siiri Lanka,0,0,1,0,0,0
vmw_train_track_a_00892,Covite-19: Asuweli a Wankoola onnaakawanya mwaha wa mwaakhulo wa Kuveerunu,0,0,0,0,0,0
vmw_train_track_a_00893,Epaariki ya nasional ya Koronkoosa eniphavela wunteererya miira otheliwa anamwane.,0,0,0,1,0,0
vmw_train_track_a_00894,"Alipo aneettiha ipakhiira a wankoola ohiya oliviha nimwaleyo mukhalelo wa Kovit-19, okhanyereriwa""oliva ikonto thana moosa sa ikwansa .",0,1,0,0,0,0
vmw_train_track_a_00895,Mário Coluna oniphwanyaneya onari nkoomani,0,0,0,0,1,0
vmw_train_track_a_00896,Feroviyariyu O Mapuutu Kampiyawo Owafiriika muhina mwa  Pasikeeti axaana axithiyana.,0,0,0,1,0,0
vmw_train_track_a_00897,Ilapo sa wAfrika ohilikana mukhalelo  wokhuma wa TPI,0,0,0,0,0,0
vmw_train_track_a_00898,Mosampiikhi  omphela ovasinar atthu mpkha imiilya 16 wa eretta ya Covid-19,0,0,0,1,0,0
vmw_train_track_a_00899,Manyakunyaku mmamikukuttani sa opooma wa oMosampiikhi,0,0,0,0,1,0
vmw_train_track_a_00900,Ekonomista onnikoha varowaka okhala wa mukhoyi wa elao y'oMosampiikhi.,0,0,0,0,0,0
vmw_train_track_a_00901,"Sol de Carvalho ni"" iphiiro sa murettele""",0,0,0,0,0,0
vmw_train_track_a_00902,Ohokotthiwa tho mukweyihero a mukhaleelo etakwa mmosa muttetthe wa Amasooniya,0,0,0,0,1,0
vmw_train_track_a_00903,"Renaamu oniphunya nikhuru na nookohakoha wiira noonele ""mipacapaciwo""",0,0,0,0,0,0
vmw_train_track_a_00904,"Musuwele ethale ya Kerry Galhos, ekwaha eniira erye “Serena Williams timoreese"" a teenixi muntiyaale",0,0,0,0,0,0
vmw_train_track_a_00905,Ewuroopa: Ethowa Muhakhu Onnivenxa Ipuliitika siniwateeriha ovolowa wa atthu,0,0,0,0,1,0
vmw_train_track_a_00906,Mosampiikhi oneettela ixikola soohikhala sa kuveerunu mwaha woohikhala ivaaka ixikola sa kuveerunu.,0,0,0,0,0,0
vmw_train_track_a_00907,Miteko  sa akulukhana ephattu  omosampiikhi  ophavela  othokoreriwa.,0,0,0,0,0,0
vmw_train_track_a_00908,"Lil Nas X ohoonihera ""isapatu sa satanas"" - Nike ohaakhula ni eporoseesu.",0,0,0,0,0,0
vmw_train_track_a_00909,Wamphula oniphaveliwa wiiwananiwawa ni Okaapu Telekaatu,0,0,0,0,0,0
vmw_train_track_a_00910,Axensiya Nasiyonaali a Patarooya ohoonanela ereserivatooriyu epheya,0,0,0,0,0,1
vmw_train_track_a_00911,Mwiiha sa evyaluwasa ni oraphiya  Omapuutu soovukuwa.,0,0,0,1,0,0
vmw_train_track_a_00912,Namalepa Mia Couto namamalela wa Ntthuvelo wa Sawu  Paawulu ya Literatuura.,0,0,0,1,0,0
vmw_train_track_a_00913,Kuveerunu wa elapo ya Mosampiiki  okuruxa ihisapu ya ephaawu.,0,0,0,1,0,0
vmw_train_track_a_00914,Ankoola: iKaapu sookoteela matteeke Isya siniruuha manyakunyaku ni sowoothasiwa,0,0,0,0,0,0
vmw_train_track_a_00915,Athu okhaliherya muttethe anilipelela wiira vanimoneleya morarelo mwaha wa wuumaliwa apinatamu wa elapo ya wankola.,0,0,0,0,0,0
vmw_train_track_a_00916,Filipe Nyusi omphavela okumanasa ni Dhlakama masi omphavela wonaneya mureerelo,0,0,0,1,0,0
vmw_train_track_a_00917,Mwavano mosampikaano ophwanya ekwerere yohoona novira miiriira ole okumihiwa mayitho ni alipo ari anamatumiha a mireerelo sa eruutthu,0,0,0,0,1,0
vmw_train_track_a_00918,Parasiili: Kuveerunu ohikittha esalaariyu ya mameetiku a mukhaleelo enamunceene wa ekumi,1,0,0,0,0,0
vmw_train_track_a_00919,Anamaweherya a miteko sosyakiha ihasara muramphani Mmosampikhi annvikela owehawehiwa wa miteko,0,0,0,0,0,0
vmw_train_track_a_00920,Mireerelo sa ephattu woottiyeliwa ni woopiha: Exeeni enithalakasa ataake ota wa elapo ya Mosampiikhi?,0,0,0,0,0,0
vmw_train_track_a_00921,American Hustle' 'Iyaakha muloko ni piili sa epottha' soxintta wa soreera sa Globos ya Ouro,0,0,0,0,0,0
vmw_train_track_a_00922,""" Ni ohoonona"": tokumentaariyu enooniherya mpantte wa mpikatani mowixiilihani oParasiili",0,0,0,0,0,0
vmw_train_track_a_00923,Meexiku: ilatarato sa weettakasiwa vokhoottela Ninyoho,0,0,0,0,0,0
vmw_train_track_a_00924,HIV/SIDA: Ameerika ni Mosampiki akwerekha mwiwanano wokhalihana,0,0,0,0,0,0
vmw_train_track_a_00925,"Alipo a Miruuku athanu Okathi wa Vaano mafirikaano anithokorerya omutthu, nttaava ni ekuluttu yoyareliwa",0,0,0,1,0,0
vmw_train_track_a_00926,"Mukhumelelo wa niinaano: Cartucho de Super Mario 64 onitumiha wa emilyawu 1,56 ya itoolare",0,0,0,0,0,1
vmw_train_track_a_00927,Alipo othaleleya anithoonya othoowa ntthitthimiho ni waamini wa apinaatamu oluluwana ni  maphattuwelo wa nihasu orupihiwa athiyana Wankoola .,0,0,0,0,1,0
vmw_train_track_a_00928,Weettakasiwa mwaha wa otumihiwa wa  atthu oMosampiikhi,1,0,0,0,0,0
vmw_train_track_a_00929,Mosampiikhi: Namuhupi onrowa ovekela wa mutthukelo mwaha wa yoowootherya,0,0,0,0,0,0
vmw_train_track_a_00930,Etakwa maaya oMeexiku teeri enithoonyeriwa variyari votumereriwa wa mireerelo sa ephattu mahala a muraanyo a etaakwa,0,0,0,1,0,0
vmw_train_track_a_00931,"Akoola Faala Soo-"" Anaaka kharowa nnakhala osikola""- Tr. Adriano Manuel",0,0,0,0,1,0
vmw_train_track_a_00932,"Okuumi wa Luaty Beirão, mulaleeryo ankolaano ori ni epwepwetthe ya etaala, owuumaseya vanceene noovira isuumamana tthaaru ohiilyaka nnakhala etthu",0,0,0,0,1,0
vmw_train_track_a_00933,Onaaniheriwa otuphela wa anawiiye oMosampiiki.,0,0,1,0,0,0
vmw_train_track_a_00934,Mitikiniho sa ohelelaniwa evenenu sinootepa wuncerereya Mmosampiikhi.,0,0,1,0,0,0
vmw_train_track_a_00935,Fereliimu onimoothererya Renaamu wiira onivira wiivaka ni wuulumelelaka.,0,0,0,0,0,0
vmw_train_track_a_00936,Masiviili ookwa mwaha wa ohaaxiwa mmekhuuluni Waninaano yaarisa alipo ohaaxiwa ni makaari masya a Trump muttetthe Wafikanixitaawu?,0,0,0,0,1,0
vmw_train_track_a_00937,Ohooneneliwa muxovo wa niinaano wa sentopeyiya elapo ya Oromeeniya,0,0,0,0,0,1
vmw_train_track_a_00938,Exiitu:Mubarak onahukhumu apoovu ni owaaliwa wa ipaako ni othowa eyoolya,1,0,0,0,0,0
vmw_train_track_a_00939,"Musurukhu oyeehiwe ereheriwaka Efeera Interenasiyonaale ya Omaputu khunirowa okhuma, alavulaka anamuupuwela.",0,0,0,0,0,0
vmw_train_track_a_00940,Mosampiikhi  ti  PALOP  ntoko  opweteya  wa  KOVIT-19  nnamwi  Ankoola  okhalana  mwattelo  wa  mwaattelo  wa  makwelo,0,0,0,0,1,0
vmw_train_track_a_00941,Ismael Mussá khanirowa wikumiha onamathanliwa,0,0,0,0,0,0
vmw_train_track_a_00942,Exitaatu Uniitu attharaka munyakenlaawe FIIFA,0,0,0,0,0,0
vmw_train_track_a_00943,Ipakeliwo sa oMosampiikhi sinlavula mwaha wa otthukweliwa wohikhoottiheriwa etthu,0,0,0,0,0,0
vmw_train_track_a_00944,COVITE-19: Mosampiikhi aaphiya atthu 606 ookhwa ni Sawu Tomee ni Pirinsipe orina atthu acexe akhwiiye nihiku nimosa,0,0,0,0,1,0
vmw_train_track_a_00945,Epaako yoopacerya ya eleeti ya oPankalateexi enooniherya mixankiho vahinatthi opaceriwa,0,0,0,0,1,0
vmw_train_track_a_00946,Trending: 50 Cen  omuhiya Biden wi omuthanle  Trump,0,0,0,0,0,0
vmw_train_track_a_00947,Yookhala ikume ohiya ohaawa,0,0,0,0,0,0
vmw_train_track_a_00948,"COVID-19 ""Alo Viita"", liinya telefoonika oMosampiikhi onnikumiha wanyihera mwaha wa eretta",0,0,0,0,0,0
vmw_train_track_a_00949,"Mulopwana mmosa wa Kine ohookhwa okathi amonaawe mphira aattikhiwa ni Porutukaale - Irawu, mutelevisawu",0,0,0,0,1,0
vmw_train_track_a_00950,Michael Schumacher wahitthikela mukhaleelo exikhaani masi mukhalelo awe onitepa okhala wohisuwanyeya.,0,0,0,0,1,0
vmw_train_track_a_00951,Kerry onivekela mukhaliheryo wa masurutaato wiira omuxintte Siiriya ni onihimya wiira EUA khaninwalela mayitho Irawu,0,0,0,0,0,0
vmw_train_track_a_00952,"Freedom House: Kaapu Veeriti, voreeraxa, ni Ankoola, vootepa.",0,0,0,0,0,0
vmw_train_track_a_00953,NASA onookela orihela nsipo na Beatles osulu,0,0,0,0,0,1
vmw_train_track_a_00954,"Makolaana anixuulihasa vowanana ikootiku ya ihukhumu esya, eniwateerha okurumula ehamela voohithanlela",0,0,0,0,0,0
vmw_train_track_a_00955,"Okhuma. o Santiyako orowaka o Utah, khivo emmunyimiha Alisha Moreira",0,0,0,0,0,0
vmw_train_track_a_00956,Axitokweene aKapu-verete anthola-thola myaha sa eretta sa Malaariya,0,0,0,1,0,0
vmw_train_track_a_00957,"Zé Du, Muhooleli ankolaano anitthikela okhalanvoomweneni wa iyaakha 38, ohookwa Oxipaanya",0,0,0,0,1,0
vmw_train_track_a_00958,Alipo a Wankoola oxaka eene vamoosa ni yookhala othoowa wa  mireerelo siilyiiwa soosukiwa.,0,0,1,0,1,0
vmw_train_track_a_00959,Manyakunyaku ni Lei Marcial o Brooklyn mwaha wa exariiya ya wookotthaniwa wa Kimani Gray,0,0,0,0,0,0
vmw_train_track_a_00960,Macapuneexi ahasomiha  manamuna a ikettelo soreera otharihela o Parasiili,0,0,0,0,0,0
vmw_train_track_a_00961,Miniixituru suuli Afirikaano a Exariya onoorowa ohoolela nivekelo yuluuliwa  oveleeliwa wa Manuel Chang,0,0,0,0,0,0
vmw_train_track_a_00962,"Okuxa muhakhu wa ekaaxi woowira mulive  muhakhu waanene, opheela omuhaaxa ole onkhala elapo ela ya oMosampiiki, ohimmye CIP.",1,0,0,0,0,0
vmw_train_track_a_00963,Ihakhi sa anamunceene siri soowoopopiha: ophiya ikhomoni wa Olumwenku sa mithinto sa oweha-weha wa ilapo Sowuraana,0,0,0,0,0,0
vmw_train_track_a_00964,Eduardo dos Santos muhooleli oniphenteliwa ni atthu vakhaanixa a Waafirika,0,0,0,0,0,0
vmw_train_track_a_00965,"oPisawu ohinakhala  ""ekaxuti ya ikokhola yanoowali"" - Nlaka na ihakhi sapinatamu.",0,0,0,0,0,0
vmw_train_track_a_00966,Boom imopiliyaariyu oLosanxele anoopopiha ihakhi ya okhala wa alipo ottyawela a atokweene ohikhalana etthu,0,0,1,0,0,0
vmw_train_track_a_00967,Feroviyariyu oMaputo owana  masi omora ni  Zamalek wupaceryani wa BAL,0,0,0,0,1,0
vmw_train_track_a_00968,kaana: Elatarato ntoko ekaruuma yooxuttihiwa manamuna amukhalelo,0,0,0,1,0,0
vmw_train_track_a_00969,Nakoso eriyari ya Faransa ni Mosampiiki pooti ophiya imilyawu 600 sa iweero.,0,0,0,1,0,0
vmw_train_track_a_00970,"Omala sowoopiha wa opuro khiserya wa irukunuwelo, ephattu oLuwanta",0,0,0,0,1,0
vmw_train_track_a_00971,"Elapo yo Wameerika ni oTurukiya aniwanana ovukulela owana-wana muttetthe wa Ankara, oSiiriya.",0,0,0,1,0,0
vmw_train_track_a_00972,Raatiyu owixeetta onihooleliwa ni mmiravo Capuneexi Oninuuherya opwanyiha muraarelo muttetthe wa Amasooniya Parasileera,0,0,0,1,0,0
vmw_train_track_a_00973,COVID-19: Looxi Anxeeli Okumiiha ewooroti muhiina  wvokhanyereeriwa okhootta.,0,0,0,0,0,0
vmw_train_track_a_00974,Reyinu Uniitu onimalela ohiya itanki mwaha wa akapwitthi siperineetika,0,0,0,0,0,1
vmw_train_track_a_00975,Mukhulupale wa nikhuru na ONU yoola oneettettela nnkhalelo Yowaalikaniherya exariya atthu elapo ya Mosampiiki.,0,0,0,0,0,0
vmw_train_track_a_00976,"Mosampiikhi: Mameetiku awaalasa ekereeve, voohiphura etthu",0,0,0,0,0,0
vmw_train_track_a_00977,ANP onilaleerya muupululo wa ekampu enitthuna okhala yoowinnuwexa olumwenku wootheene,0,0,0,0,0,1
vmw_train_track_a_00978,Eporovinsiya ya Kaapu Telekaatu ennipaka nakoso ni epooma ya Xowanexipuuruku.,0,0,0,0,0,0
vmw_train_track_a_00979,Mosampiiki:Namalepa ekonxitituwisawu oosuwelexiwa onoovaanyiha yoottharuxa ya nlamulo nuulupale.,0,0,0,0,0,0
vmw_train_track_a_00980,Ruusiya: Nvaanelo Owiiva mwahawa soowurya sinihapala ni Oviiha,0,0,0,0,1,0
vmw_train_track_a_00981,Mosampiiki:Yoovahiwa ya imilyawu 688 sa itoolare para orosamento wa 2012,0,0,0,0,0,0
vmw_train_track_a_00982,Itumereeryo ya osiiriya sinittiyela ekhotto ya iwarakha soowanana apinaatamu,0,0,0,0,1,0
vmw_train_track_a_00983,Kuwayit : Owooniheryaka soothuma sa  muhina mwa lompiiuata,0,0,0,0,0,0
vmw_train_track_a_00984,Ukaraaniya: Ohaawa wa mataarutaru o Kirimeeya,0,0,0,0,1,0
vmw_train_track_a_00985,' Akhala atthu anikasooa ophiiya  vakhiiru mwaha wooweha wiira ari  neeretta' onihinya mulipo ohithokoreryana mirutthu ooxerexere wa Sawu Paawulu,0,0,0,0,0,0
vmw_train_track_a_00986,Niceeriya: Ekampanya #Bringourgirlsbackonikhanyererya otapwuliwa axiruusi ovarakasiwa,0,0,0,0,0,0
vmw_train_track_a_00987,Mutthenkeso wohikhala oofalume onnathoonya aweri opisiha okhalela wa mitthenkeso sa mulaponi wahu wa miteko sa nakoso.,0,1,0,0,0,0
vmw_train_track_a_00988,Kuveernu ni mapanifikatoore anihaavyasa wiiwanana mwaha wa esisapo ya phawu,0,0,0,1,0,0
vmw_train_track_a_00989,Nihasu na vapuwani khanipwanyiha ikwove mipaatta sovirikana sa miteko sa Omosampiilhi,0,0,0,0,0,0
vmw_train_track_a_00990,Elapo ya Ankoola onnilavuliwawo wi- Armando Machado: ''Ekiipa yeela yaarowa opaka itthu soreera''.,0,0,0,0,0,0
vmw_train_track_a_00991,Mosampiikhi ahimananiiha omoomola nahapaari okhopela nuumala orevokaar nemereeryo nawe,1,0,0,0,0,0
vmw_train_track_a_00992,Washington Redskins oohiya nsinana awe mwaha wa miwehaweho rasiixita,0,0,0,0,0,1
vmw_train_track_a_00993,""" Niirisi vootepa okhala ntoko vahinakhale ahu"": Coral Herrera ni Ekhotto ya mwaha wolikanasa wa alopwana ni athiyana",0,0,0,1,0,0
vmw_train_track_a_00994,"wAmasooniya parasileera, ovarihaniwa mihuuru ni ekwerere enihooleliha miriira sa ehasara",0,0,1,0,0,0
vmw_train_track_a_00995,Evasina emosa yoolola oretta wa ettekuxa ehehereriwa elapo yo Purukina Faso,0,0,0,1,0,0
vmw_train_track_a_00996,"Anipheela othanliwa ""Autaarkika"" anixaya evootu otakwani wooMaputu",0,0,0,0,0,0
vmw_train_track_a_00997,Oxinttiwa Parasiili wa mixinttano sa molumwenkuni onmalela ni manyakunyaku,0,0,0,0,1,0
vmw_train_track_a_00998,"Wa mukhumelelo woopacverya, minupi sa atinasoowuru ni munupi wa nrattha soophwanyiwa Owaafirika",0,0,0,0,0,1
vmw_train_track_a_00999,Aximaayi anamalaleerya tthukwelisa wAnkoola aniwateerihiwa wixuuliha,1,0,0,0,0,0
vmw_train_track_a_01000,Ekonya yuulupale yookela mukampu mwa koolife mukano wa Ofoloorita,0,0,0,0,0,1
vmw_train_track_a_01001,"Woopopiha wa ekhotto siviili enitthikela oMosampiikhi, apinaatamu ottyawelasa",0,0,1,0,0,0
vmw_train_track_a_01002,ADI ompacerya ovaanela wiira opake eKuvernu ya yoothukumana elapo yootheene,0,0,0,0,0,0
vmw_train_track_a_01003,Mulopwana oxittale ekwaha emosa tuoorowa mmekhuuluni masi ohikhalane ehakhi yowixeetta vaTthayani,0,0,0,0,0,0
vmw_train_track_a_01004,Orattela olavuula anti Xiina wa Bolsonaro  waroowa olyihaka onyokhana variyari ni masiyatiku oParasiili.,0,0,0,0,0,0
vmw_train_track_a_01005,"oParakwaayi, axiruusi ophoova okhala asikhiini anihoolela muteeko sookhanyereriwa wii akweeherye osooma.",0,0,0,0,0,0
vmw_train_track_a_01006,Kuveernu mosampikaanu onincerera esisapo ya ephaawu paahi eyaakha ya 2017,0,0,0,0,0,0
vmw_train_track_a_01007,Anamuteko akhalayi awAvíkola ya Wamphula aniisoona owokiwa ni Kuveerno,1,0,0,0,0,0
vmw_train_track_a_01008,"Mwaakha wa amwaathanle oParasiili, athiyana muhina mwa ipuliitika anilaleerya yowopiha wa ninaanoxe",0,0,0,0,0,0
vmw_train_track_a_01009,Liika Kineese ya Ihaakhi Sapinatamu elaleerya eliivuru,0,0,0,0,0,0
vmw_train_track_a_01010,Ankoola: Namalaleerya omanakasiwe waattamela epuruma puruma,0,0,0,0,1,0
vmw_train_track_a_01011,Pilisa  Omosampiikhi  oniirela  mpantta  wa  orimeela  wa inyaka a  erinoserooti.,1,0,0,0,0,0
vmw_train_track_a_01012,Ithaatuwa annikhumelela mwa ananakoso a mapantta,0,0,1,0,0,0
vmw_train_track_a_01013,Kuverunu a wAnkoola omphavela olikanyiha musurukhu ya waakhaliherya martixita.,0,0,0,1,0,0
vmw_train_track_a_01014,Nttetthe wa Uniyaawu Ewuropeeya noovaha musurukhu woophiyelela 734 imiyasene sa ewuuro elapo ya Mosampiiki.,0,0,0,1,0,0
vmw_train_track_a_01015,Marooko: Muttetthe ya Tanger oonihoolela oosareyiwa  woophova,0,0,0,0,1,0
vmw_train_track_a_01016,Nasa ohoonenela epalaneeta ya namuloko ya esixiteema solaare,0,0,0,0,0,1
vmw_train_track_a_01017,Anamasuwela wa OMS antthokelela ommaliha eepola oKine-Pisawu,0,0,0,0,0,0
vmw_train_track_a_01018,Ilapo Soowiirana sa Waameerika ni Wiiraana Weewuroopa aninyohola yoolakela ya Niceeriya yoomuthikilela Twitter,0,1,0,0,0,0
vmw_train_track_a_01019,"Ramadani Momade, nsu nsiya na Metankula",0,0,0,0,0,0
vmw_train_track_a_01020,Wamphula: anamarakala  oohikhalana muteko woovara,0,0,0,0,1,0
vmw_train_track_a_01021,Anamahooxiwa mwaha wa mutaseke Itayi annivoliwa etala oManika,0,0,0,0,1,0
vmw_train_track_a_01022,Mwanamukhaya Kenneth ookela Omakomiya ni Omusimpwa wa Ephareya ni oopacerya ohamanya.,0,0,0,0,1,0
vmw_train_track_a_01023,"Kanata:"" Orimeela"" wa athiyana mantiixina",0,0,0,0,1,0
vmw_train_track_a_01024,"Frank Paco: ikwaha sootheene ikwaha sootheene kiniiwaaka mitthaka soohirrera mwaha wa ikhotto, muupuwelo ni mavekelo anrowa wa atthu a Mosampiikhi.",0,0,0,0,1,0
vmw_train_track_a_01025,Anamaxaya oowiiya aareeriha muteko aya oMosampiikhi.,0,1,0,0,0,0
vmw_train_track_a_01026,Joseph Blatter ti otthikela othaliwa vasya ni mukhaleelo wa nfalume a  FIFA,0,0,0,0,0,1
vmw_train_track_a_01027,Owela wa esisapo ya oliwerya wa ikhokhola ennaxankiha athu a Wamphula.,1,0,0,0,0,0
vmw_train_track_a_01028,"Mapixikisatoore a siyensiya apinaatamu othatuuwa 'awana awanani Elapo' oParasiili, onihinya antoropooloka",0,0,0,0,0,0
vmw_train_track_a_01029,Wafiriika onihaaya iphiiro sinireliwa kathoowa mwakha wa KOVIIT-19,0,0,0,0,0,0
vmw_train_track_a_01030,"oMosampiikhi, sikeyite esinoonimu ya etukasawu, ovaha owerya, ni oxuttiha",0,0,0,0,0,0
vmw_train_track_a_01031,Dos Santos vasyaa oXipaanya,0,0,0,0,0,0
vmw_train_track_a_01032,"Koviti-19: Kuverunu ankolaano ohaana orerihaka mananna ya olavulihana, annihima asuweli.",0,0,0,0,0,0
vmw_train_track_a_01033,Onimala naanaano para LAM omwiira nakoso meekhaaya,0,0,0,0,0,0
vmw_train_track_a_01034,Mosampiikhi anniwelela orukunuwasa wa epheyo,0,0,0,1,0,0
vmw_train_track_a_01035,Filipe Nyusi oLontres wa Esimera ya Commonwealth,0,0,0,0,0,0
vmw_train_track_a_01036,Mosampiiki eriyari ya ilapo sootepa oweriyiwa ni VIH,0,0,1,0,0,0
vmw_train_track_a_01037,"Top Ten Amerikaano: ovinrene otuthuwa, Rick Ross ootthika, Kotisi Palan te Tarake ekoma eniiwiwa mahiku ala.",0,0,0,0,0,0
vmw_train_track_a_01038,"Mosampiikhi: Anamurwa aninyanya elapo, anitthikela akhalaka oMakomiya ni avenxa epantera ya okhala wamwiisilamu.",0,0,1,0,0,0
vmw_train_track_a_01039,Areeti amihupi WiFi  annikarakanyulasiwa wa Avaana,0,0,0,0,1,0
vmw_train_track_a_01040,Ankoola: olikanaasa variyari va Kapiita ni Timoore Leste,0,0,0,0,0,0
vmw_train_track_a_01041,Miteko soolima oParakwaayi anoonaneya owalameela ni aliimi anikhanyererya wii Kuveerunu opwaanye iphiiro saya,0,0,0,0,1,0
vmw_train_track_a_01042,COVITE-19: Miyaha sa oretta wa oretta sinnincerereya mMosampikhi mpakha imiya xexe ni thannaxexe ni okhumelela miloko mithanu ni thanu wa iwoora miloko miili ni xexe sokhiserya.,0,0,1,0,0,0
vmw_train_track_a_01043,Mmosa mikhotto akhalayi ninaano ohoolo wa El Saluvatoote. Onoorowa wii olé oweereya weemexa wiiva?,0,0,0,0,0,0
vmw_train_track_a_01044,Mosampiikhi: Waakhula wa Ehasara ya Mupooma wa nihiku ti nihiku,0,0,0,0,0,0
vmw_train_track_a_01045,Piyamwene Elizabeth ompaka Bill Gates okhala kavaleyiru,0,0,0,0,0,1
vmw_train_track_a_01046,Noveleelihiwa wa top moteeli  oniireliwa opuro othokoreeriwa olipo ari naanepa asaawu viseeti anoovelela Wii itumereeryo ni mapatiriyaaraka taani okhale mmpuwa mwamphiira,0,0,1,0,0,0
vmw_train_track_a_01047,Nilaleeyo muhina mwa fesipookhi nikhoottelaka waakameliwa muttetthe oKirimeeya otanya okuruxiwa muteko a nahapaari ruusu,0,0,0,0,0,0
vmw_train_track_a_01048,Kuupa oniira omananihaka omaaliha emiitiyaintepenteete? Nlamulo na etekereto esta onoorowa okhottiha opaka wa akhopela muhina mwa weepi,0,0,0,0,0,0
vmw_train_track_a_01049,Anamurwa mamosampikaanu Wafiriika ti suuli anookhalana epilyeti yoowasuweliha,0,0,0,1,0,0
vmw_train_track_a_01050,Ankoola: Anamatumiha anihoolela okumi woovila vamosa ninttittimiho ni erooho,0,0,0,0,0,0
vmw_train_track_a_01051,Afalume a wAfirika tusuuli anvekela muswanmaha wa samanyala sivariwe wa mukhalelo atthu a ilapo sokhopela,1,0,0,0,0,0
vmw_train_track_a_01052,Kheeniya: onyokhana maloko ohaapaka ohaawi oopacerya muhina mwa iterineeti,0,1,0,0,0,0
vmw_train_track_a_01053,Muhooleli a Mwalaano Opaceerya awuxtaraliyaano anikhaseeyiha sohinyalasiwa sa ninyoho muhina mwa elapo ya Siiri Laanka,1,0,0,0,0,0
vmw_train_track_a_01054,Mosampiikhi: ilatarato sa muskeleeta taakisi oKhilimani,0,0,0,0,0,0
vmw_train_track_a_01055,Mwaattelo wa mwaatakareliwo a matakisiixita onivukula miteko epooma ya Wamphula.,0,0,1,0,0,0
vmw_train_track_a_01056,Anamaxaya owiiya aniivasa 200 itthomottho abatem oMosampiikhi,0,1,0,0,0,0
vmw_train_track_a_01057,' Muthiyana - oorumeela: Nikhuru na solemphwa sothaleeliwa' onihinya Ninyoho nowanana athiyana ohisilimu ôta - wameerika,0,1,0,0,0,0
vmw_train_track_a_01058,Mapuutu : othipeliwa nluku noopacerya oniireliwa otekiwa exiripitaali yooluluwana vamoosa ni HIV,0,0,0,1,0,0
vmw_train_track_a_01059,Mulipa onikhala EUA oothuma ipilyeti 20 sa elotariya ni ooxintta ivaara 20,0,0,0,0,0,1
vmw_train_track_a_01060,Ohiira mpatta mmuphirani wa namphira dos Santos mpakha nlelo khusuwaneya.,0,0,0,0,0,0
vmw_train_track_a_01061,Carlos Agostinho do Rosário miniixituru-oopacerya vasyaa,0,0,0,0,0,1
vmw_train_track_a_01062,Ilapo Soowiirana sinnittottopela omaala wa ikapwitthi ni annivekelela murettele ohinimala oMaputo,0,0,0,0,0,0
vmw_train_track_a_01063,Onikela  ohoolo muteko olamuliwa wa  amahooleli  a  exiripitaali  ya  aximaayi-ni  anamwane  ya  Omalaance,0,0,0,0,0,0
vmw_train_track_a_01064,Porokarama sa wataaneya sinnakhaliha athiyana akhweliwe ayiya Wamphula,0,0,0,1,0,0
vmw_train_track_a_01065,Marooko: Opweteeya wa karniseero Basri,0,0,0,0,1,0
vmw_train_track_a_01066,"Eliivuru ""Mafalala: memorias e espaços de um lugar"" opasari etuminku enirwa.",0,0,0,0,0,0
vmw_train_track_a_01067,Elo oorimeela mmwirini xeneyalooxika wa pterossauros ohoonaneliwa,0,0,0,0,0,1
vmw_train_track_a_01068,"KAN 2021: Okwakwilya  ni Kovit-19, tekiniiku Kineexi olipelela okhala "" eparakha"" omukuthanoni  waya ni Iciitu",0,0,0,0,0,0
vmw_train_track_a_01069,Mosampiikhi: ifeeriya sa muxariyani sinnikawanya miyuupuwelo sa atthu,0,0,0,0,0,0
vmw_train_track_a_01070,"""Okhwa etthu anlipelelaya atthu ootheene, maxi okhala okathi ohanle na nihiku nanyu khahiyo,"" Vanessa Bryant",0,0,0,0,1,0
vmw_train_track_a_01071,"""Tubarões Azuis"" nookhalana oweerya wowerya wiirela mmpantte oleelo eroowaka nlaka notharelana na KAN",0,0,0,0,0,0
vmw_train_track_a_01072,Guinness: parasileyira ooxintta mulapuwelo wa muro wa lava,0,0,0,0,0,1
vmw_train_track_a_01073,"Mosampiiki onitthuna imilyawu ikonto 11,6 sa itoolare para iwoopora s'atthu ootheene",0,0,0,0,0,0
vmw_train_track_a_01074,CBF onvekela osuwela muhina mwa FIFA mwa soovonyiya wa mphiira ni Suisa,0,0,0,0,0,0
vmw_train_track_a_01075,Meexiku: Moolumo a Muhooleli oopisa ni ohiroromeleliha,0,0,0,0,0,0
vmw_train_track_a_01076,Opuro oneemela akareera mohitthunyeliwa nnakhala moohireeriheliwa ahooniherya ivirikaneelo variyari va ikuluuttu sa oSaaw Paawulu,0,0,0,0,1,0
vmw_train_track_a_01077,Amahoolele a w'Afirika anipaka nikhuro na nakoso ootthukuliwa,0,0,0,1,0,0
vmw_train_track_a_01078,Meera a ikhalelo oLuwanta anoorowa okumiherya mivaanelo ni matthokiheryo a nlaka na ikuwo mulaponi.,0,0,0,0,0,0
vmw_train_track_a_01079,Ixipitali sa Malanxe khasirina musurukhu wii elive anamuteko,0,0,0,0,1,0
vmw_train_track_a_01080,Esisapo ya ephaawu enoowela oMosampiiki okhuma meelo,0,0,0,0,0,0
vmw_train_track_a_01081,Wa okhaliheryana wa murima wookumiha eyoolya.,0,0,0,0,0,0
vmw_train_track_a_01082,Biden  oniira ori okupalyene wiira Putin otisitiri watakari muttetthe wa Ukaraaniyaw,0,0,0,0,0,0
vmw_train_track_a_01083,COVID 19: Nikhuru na athu anceene  aniwana ni omalamaleiha oHuila.,0,0,0,1,0,0
